id,name,price,onSale,color,material,condition,occasion,brand,manufacturer,hasHeels,countryOfOrigin
AVpe__eOilAPnD_xSt-H,Handcrafted Alpaca Blend 'Purple Charisma'  (Peru),62.99,FALSE,Purple,,,,Novica,,FALSE,
AVpe__JXilAPnD_xSt3F,Pedi Couture Women's Blue Snake Pedicure Spa Toe Separator Sandal Flip Flops (m),30,FALSE,,Foam,,,Pedi Couture,Pedi Couture,FALSE,
AVpe_0ob1cnluZ0-bnWr,"Sof Comfort Women's Everyday Gel Insoles, 2-pair",10,FALSE,"Multicolor,MULTI",,,,BEAUTIFEET,,FALSE,
AVpe_0PU1cnluZ0-bnM4,"Sneed- Women's/kids' Dance Shoes Latin Leatherette/paillette Flat Heel Blue/pink/silver/gold, Blue-us1 / Eu32 / Uk13 Little Kids , Blue-us1 / Eu32 / Uk13 Little Kids",70,FALSE,,,,,,SNEED,FALSE,
AVpe_-0YilAPnD_xStvJ,Marc Fisher Fawna Women  Cap Toe Leather  Oxford,89,FALSE,,Leather,,,Marc Fisher,Marc Fisher,TRUE,
AVpe_19KilAPnD_xSqnY,Caparros Karissa   Open Toe Canvas  Sandals,79,FALSE,Silver,Canvas,,,Caparros,Caparros,TRUE,
AVpe_1KTilAPnD_xSqVK,Inc International Concepts Britanii   Pointed Toe Suede  Heels,90,FALSE,,Suede,,,INC International Concepts,INC International Concepts,FALSE,
AVpfsM0a1cnluZ0-peym,Lugz Women's Zen LO by Lugz,78.95,FALSE,Grey,,,,Lugz,,TRUE,China
AVpe_1Qw1cnluZ0-bnlG,Women's Skechers BOBS Pureflex Supastar Flat Black by Skechers,50.95,FALSE,,,,,Skechers,,FALSE,United States
AVpe_1SHLJeJML430GHi,Dbdk Fashion Meira-4 Women  Open Toe Synthetic  Wedge Sandal,60,FALSE,,Synthetic,,,DbDk Fashion,DbDk Fashion,TRUE,
AVpe_22H1cnluZ0-boH3,Shoe Crepe Rubber For Nubuck & Suede Collonil Cleaner,8.99,FALSE,,,,,Collonil,Collonil,FALSE,
AVpe_2Gv1cnluZ0-bn35,Vince Camuto Parka   Round Toe Suede  Ankle Boot,159,FALSE,Brown,Suede,,,Vince Camuto,Vince Camuto,FALSE,
AVpe_34HilAPnD_xSrP8,Bloch Women Twist Dance Sneakers 6.5 X Us,63.5,FALSE,"White,Black,Silver",,New,,Bloch,Bloch,FALSE,
AVpe_3ai1cnluZ0-boTX,Michael Kors Fulton Riding Tall Boot Black Leather Knee High Boots Sz 11 $398,180,FALSE,Black,Leather,New with box,,Michael Kors,,FALSE,
AVpe_3d11cnluZ0-boUh,Nike Women's Kaishi Running Shoes,59.98,FALSE,,,,,Nike,,FALSE,
AVpe_4ijilAPnD_xSrfB,Women's Wild Diva Camila-64 Brown Faux Leather by Wild Diva,44.95,TRUE,Brown,,,,Wild Diva,,TRUE,United States
AVpe_4OLLJeJML430HJo,"Skechers Size 6 Plain Toe Athletic Style Work Shoes, Women's, Black, Ew, 76033ew-b Sz 6",57.6,FALSE,Black,,,,SKECHERS,Skechers,FALSE,
AVpe_5291cnluZ0-bpLy,Womens Halloween Sexy Black Patent Retro Boots,57,FALSE,,Polyurethane,New,Halloween,Pleaser Shoes,Pleaser Shoes,FALSE,
AVpe_54gilAPnD_xSr-B,Faded Glory Women's Fashion Slouch Boot,20.03,TRUE,"TAN,Grey",Fabric,,,Faded Glory,,FALSE,
AVpe_5gk1cnluZ0-bpDd,Corky's Stadium Stompers Women's Western Rain Boots Wellies Sz 6,29.99,FALSE,,,,,Corky's,Corky's,FALSE,
AVpe_5NuilAPnD_xSruY,"Jessica Simpson Apple Pumps Hi Heel Women's Shoes,black Color, Size:10m,new",49.99,FALSE,Black,all man made materials,New with box,"casual,special occassion,evening shoes",Jessica Simpson,,TRUE,
AVpe_61NilAPnD_xSsUl,Jbu By Jambu Cordoba   Round Toe Leather  Clogs,69,FALSE,Brown,Leather,,,JBU by Jambu,JBU by Jambu,TRUE,
AVpe_6BgLJeJML430HyZ,Style & Co Vern   Open Toe Synthetic  Wedge Sandal,19.99,FALSE,Beige,Synthetic,,,Style & Co.,Style & Co,FALSE,
AVpe_6FoLJeJML430Hzu,Caparros Savanna Women  Peep-toe Synthetic  Heels,79,FALSE,Silver,Synthetic,,,Caparros,Caparros,TRUE,
AVpe_6lhLJeJML430H_G,Asics Women's Gel-190 Tr Cross-training Shoes - Wide,79.99,FALSE,,,,,ASICS,,FALSE,
AVpe_6nr1cnluZ0-bpdo,Arizona Jean Company Collette Women  Round Toe Canvas Brown Mid Calf Boot,90,FALSE,Brown,Canvas,,,Arizona Jean Company,Arizona Jean Company,TRUE,
AVpe_765ilAPnD_xSstH,Ellen Tracy Faith   Peep-toe Leather  Heels,21.99,FALSE,Beige,Leather,,,Ellen Tracy,Ellen Tracy,FALSE,
AVpe_7BFilAPnD_xSsYU,Wanted Stampede Women Us 8 Brown Knee High Boot,105,FALSE,,Synthetic,,,WANTED,,TRUE,
AVpe_82S1cnluZ0-bqR7,"Sneed- Customized Latin Women's Sandals Customized Heel Dance Shoes With Rhinestone Buckle More Colors, Gold-us7.5 / Eu38 / Uk5.5 / Cn38 , Gold-us7.5 / Eu38 / Uk5.5 / Cn38",101,FALSE,,,,,,SNEED,FALSE,
AVpe_8C8ilAPnD_xSswn,Mia Girl Adrianna   Open Toe Synthetic  Sandals,59,FALSE,Beige,Synthetic,,,Mia Girl,Mia Girl,TRUE,
AVpe_8du1cnluZ0-bqHj,"Sneed- Customizable Women's Dance Shoes Latin/salsa Satin Customized Heel Black/blue/yellow/pink/purple/red/white/fuchsia, Red-us5.5 / Eu36 / Uk3.5 / Cn35 , Red-us5.5 / Eu36 / Uk3.5 / Cn35",88,FALSE,,,,,,SNEED,FALSE,
AVpe_8Hg1cnluZ0-bp_0,Born Women's Tami Leather Ankle-high Leather Flat Shoe,71.76,FALSE,"Red,Tan,Gold",,,,Born,Born,FALSE,
AVpe_8RgilAPnD_xSs1m,Helly Hansen Boots Womens W Midsund 2 Rubber Outsole Print 11152,65,FALSE,,,,,Helly Hansen,Helly Hansen,FALSE,
AVpe_8S5ilAPnD_xSs2U,R.b.l.s. Abba   Open Toe Synthetic  Slides Sandal,30,FALSE,Black,Synthetic,,,r.b.l.s.,r.b.l.s.,TRUE,
AVpe_8sULJeJML430IxI,Mizuno Wave Rider 18 Women  Round Toe Synthetic Red Running Shoe,120,FALSE,,Synthetic,,,Mizuno,Mizuno,FALSE,
AVpe_8tuLJeJML430IyA,"Sneed- Customizable Women's Dance Shoes Latin/salsa Satin Customized Heel Black/blue/yellow/pink/purple/red/white/fuchsia, Almond-us8 / Eu39 / Uk6 / Cn39 , Almond-us8 / Eu39 / Uk6 / Cn39",148,FALSE,,,,,,SNEED,FALSE,
AVpe_AngLJeJML43zz5S,Michael Kors Women's Olivia Perforated Espadrille Wedge Sandals,68.99,FALSE,"Black,Luggage",,,,Michael Kors,Michael Kors,TRUE,
AVpe_aob1cnluZ0-beQ9,Giani Bernini Aikko   Open Toe Suede  Sandals,89,FALSE,Brown,Suede,,fashion,Giani Bernini,Giani Bernini,TRUE,
AVpe_Auy1cnluZ0-bVf3,Personal Identity Women's Castro Black Slouch Bootie,39.99,FALSE,Black,,,Casual,Personal Identity,,TRUE,
AVpe_aXVilAPnD_xSg7n,Nature Breeze Rainforest-05h Women's Stylish Buckle Strap Winter Rain Boot Shoes,57.98,FALSE,BLACK,,,Casual,Nature Breeze,,TRUE,
AVpe_b4Y1cnluZ0-bes6,Yu&yu Women's Shoes Comfort Round Toe Flat Heel Flats Shoes More Colors Available,164.63,FALSE,"Black,Almond,Pink",,,,,Qianyuyu,FALSE,
AVpe_B5I1cnluZ0-bV6E,7/30/2016 10:27,90,FALSE,US,,New with box,,Iron Fist,,FALSE,
AVpe_BbLilAPnD_xSYfP,Lillian Rose Jelly Flip Women  Open Toe Synthetic Clear Flip Flop Sandal,14,FALSE,Clear,Synthetic,,wedding reception,Lillian Rose,Lillian Rose,FALSE,
AVpe_BdrilAPnD_xSYgF,Women's Dyeables Becky White Satin by Dyeables,51.96,FALSE,White,,,,Dyeables,,TRUE,United States
AVpe_bhuLJeJML43z9CI,Array Whistler Women  Round Toe Leather  Ankle Boot,132,FALSE,,Leather,,fashion,Array,Array,TRUE,
AVpe_-BILJeJML430JQV,"Sneed- Customized Shoes Women's Dance Shoes Sparkling Glitter Latin Salsa Shoe, Silver-us8 / Eu39 / Uk6 / Cn39 , Silver-us8 / Eu39 / Uk6 / Cn39",88,FALSE,,,,,,SNEED,FALSE,
AVpe_bO-1cnluZ0-befC,"Sneed- Customizable Women's Dance Shoes Latin/salsa Satin Customized Heel Black/blue/yellow/pink/purple/red/white/fuchsia, Yellow-us9.5-10 / Eu41 / Uk7.5-8 / Cn42 , Yellow-us9.5-10 / Eu41 / Uk7.5-8 / Cn42",86,FALSE,,,,,,SNEED,FALSE,
AVpe_BynilAPnD_xSYoR,"Sneed- Non Customizable Women's Dance Shoes Latin Satin/paillette Stiletto Heel Black/blue/brown/pink/red/silver/gold/leopard, Fuchsia-us4-4.5 / Eu34 / Uk2-2.5 / Cn33 , Fuchsia-us4-4.5 / Eu34 / Uk2-2.5 / Cn33",53,FALSE,,,,,,SNEED,FALSE,
AVpe_BZ9LJeJML43z0Jn,Alfani Women's Maloree Open Toe Suede Slingback Sandal,24.93,FALSE,Ink,,,,Alfani,Alfani,FALSE,
AVpe_cEM1cnluZ0-bexk,Nocona Boots Women's Old West Tan L Toe Boot,209.99,FALSE,,,,,Nocona Boots,,FALSE,
AVpe_CHjilAPnD_xSYwf,Muk Luks Women's Felicity Boots,62,FALSE,"Cream,Navy,Vanilla",,,,MUK LUKS,Reliable of Milwaukee,FALSE,
AVpe_CLFLJeJML43z0bH,Baretraps Felicity   Round Toe Synthetic  Knee High Boot,100,FALSE,Brown,Synthetic,,,BareTraps,Baretraps,FALSE,
AVpe_CllLJeJML43z0lJ,Cap Toe Suede Sneaker (women),595,FALSE,,,,,Lanvin,,FALSE,
AVpe_clvLJeJML43z9ZL,Franco Sarto L-venezia Women Us 8m Black Peep Toe Flats,30,FALSE,Black,,New with box,,Franco Sarto,,TRUE,
AVpe_cNoLJeJML43z9RW,Dr. Weil By Orthaheel Rhythm White Blue Lace-up Sneakers,109.99,FALSE,WhiteBlue,Mesh,,,Dr. Weil,Dr. Weil,FALSE,
AVpe_cNxLJeJML43z9Rb,Annie Shoes Lantern  W Open-toe Canvas  Heels,60,FALSE,,Canvas,,,Annie Shoes,Annie Shoes,TRUE,
AVpe_CTdilAPnD_xSY0f,Famous Name Brand Amber Women Us 8 Black Gladiator Sandal,40,FALSE,,Synthetic,,,FAMOUS NAME BRAND,,TRUE,
AVpe_CxFilAPnD_xSY_X,Womens Michael Michael Kors Yvonne Caged Open Toe Dress Sandals - Dark Khaki,195,FALSE,,Suede,,,Michael Kors,Michael Kors,TRUE,
AVpe_do3LJeJML43z9wh,Yu&yu Women's Shoes Ballerina Flat Heel Flats Shoes More Colors Available,38.87,FALSE,"White,Red,Black,Beige",,,,,Qianyuyu,FALSE,
AVpe_DXuLJeJML43z03v,Skechers Women's Royal Forward Memory Foam Relaxed Fit Black Running Shoe,69.99,FALSE,Black,,,,Skechers,,FALSE,
AVpe_dzlLJeJML43z90K,Bcbgeneration Women's Frenchy Leather Ginger Ankle-high Leather Flat Shoe - 6m,55.56,FALSE,,,,,BCBGeneration,Bcbgeneration,FALSE,
AVpe_e0_LJeJML43z-LD,"Touch Ups Womens Irene Peep-toe Pump,ivory/silver Glitter,9.5 M Us",61.99,FALSE,,,,,Touch Ups,,FALSE,
AVpe_egfLJeJML43z-D1,Asics Gel-nimbus 16 Women's Us Sz 7 Iridescent Pink Capri Blue T485q 0235,159.99,FALSE,IRIDESCENTPINKCAPRI BLUE,MESH,New with box,,ASICS,,FALSE,
AVpe_eH-ilAPnD_xSiPe,Volatile Wild Foxy Women's Wedge Platform Sneakers Shoes Leather,80,FALSE,,,,,Volatile,,TRUE,
AVpe_EJ81cnluZ0-bWvg,Annie Shoes Lynn Womens X Wide Pumps Heels Shoes New/display,60,FALSE,Green,,,,Annie,,FALSE,
AVpe_eonilAPnD_xSiaY,Yu&yu Women's Shoes Pvc Flat Heel Comfort Open Toe Slippers Casual Blue/pink,36.87,FALSE,"Blue,Pink",,,,,Qianyuyu,FALSE,
AVpe_erFLJeJML43z-HQ,"Me Too Womens Lilyana Leather Ballet Flat Shoe, Pewter Metallic, Us 9",79,FALSE,,Leather,,,Me Too,,TRUE,
AVpe_FEFLJeJML43z1d0,Franco Sarto Padua   Round Toe Leather  Mid Calf Boot,140,FALSE,Black,Leather,,,Franco Sarto,Franco Sarto,TRUE,
AVpe_fH0LJeJML43z-SB,Sanita Prof Dream   Round Toe Patent Leather  Clogs,205,FALSE,Green,Leather,,,Sanita,Sanita,TRUE,
AVpe_FHVilAPnD_xSZ2_,Bc Footwear Fast Lane Women Us 7.5 Silver Gladiator Sandal,50,FALSE,,Synthetic,,,BC Footwear,,TRUE,
AVpe_fkcilAPnD_xSivo,"Delight-1018uv, 6'' Heel, 1 3/4'' Platform Ankle Boot",46.99,FALSE,Neon Yellow PatYellow,,,,PleaserUSA,PleaserUSA,TRUE,
AVpe_fKZLJeJML43z-S9,Easy Spirit Womens Tosina Suede Loafers Fashion Sneakers,89,FALSE,BlackBlack Suede,Leather/Textile/Man Made,,,Easy Spirit,Easy Spirit,TRUE,
AVpe_fMbilAPnD_xSinw,So For Her Jelly Sandals White Size Large (9/10),19.95,FALSE,,,,,So For Her,So For Her,FALSE,
AVpe_FswLJeJML43z1tk,Puma Axel Ballet Metallic Women's Shoes Size,59.9,FALSE,LimestoneSilverFluro Pink,,,,PUMA,,FALSE,
AVpe_FYT1cnluZ0-bXMH,Allegra K Women's Open Toe Lace-up Cutout Platform Wedge Sandals Black (size 11),70.99,FALSE,,PU,,,G Antini,,FALSE,
AVpe_g_bLJeJML43z-4y,Diesel Eagles Women  Round Toe Suede  Boot,197,FALSE,,Suede,,,Diesel,Diesel,TRUE,
AVpe_Gbu1cnluZ0-bXke,Reebok Yourflex Trainette 7.0lmt Women  Round Toe Synthetic  Cross Training,60,FALSE,CherryWhite,Synthetic,,,Reebok,Reebok,FALSE,
AVpe_Gc-ilAPnD_xSaV9,Crocs Kadee Flat   Round Toe Synthetic  Flats,31.95,FALSE,Black,Synthetic,,,Crocs,Crocs,TRUE,
AVpe_GD0LJeJML43z11w,Kate Spade Ilisandra   Peep-toe Synthetic  Mules,328,FALSE,Multicolor,Synthetic,,,kate spade,kate spade,TRUE,
AVpe_gDiilAPnD_xSi5S,White Mountain Latara Women  Round Toe Synthetic Brown Knee High Boot,100,FALSE,Brown,Synthetic,,,White Mountain,White Mountain,TRUE,
AVpe_gjjilAPnD_xSjEP,Journee Collection Women's 'Shelley-3' Slouch Mid-Calf Microsuede Boot by Journee Collection,33.14,FALSE,"Black,Brown,Grey,Purple",,,,Journee Collection,,TRUE,China
AVpe_h2LLJeJML43z_MH,Women's Classic Ballet Flat,5.87,FALSE,,,,,Generic,,FALSE,
AVpe_HaQilAPnD_xSasO,"Sneed- Women's Dance Shoes Latin Pu Low Heel (more Colors), Leopard-us4.5 / Eu36 / Uk3.5 Big Kids , Leopard-us4.5 / Eu36 / Uk3.5 Big Kids",62,FALSE,,,,,,SNEED,FALSE,
AVpe_hb31cnluZ0-bglN,Giro Sante Ii Women  Round Toe Patent Leather  Cross Training,100,FALSE,Black,Leather,,athletic,Giro,Giro,FALSE,
AVpe_hd8ilAPnD_xSjXX,"G By Guess Women's Dawna Platform Sandal, Tan, Size 8.0",33.54,FALSE,Light Natural,,,Formal,G BY GUESS,G by Guess,TRUE,
AVpe_heL1cnluZ0-bglw,Madison Harding Jackie 13 Women  Round Toe Suede  Bootie,280,FALSE,,Suede,,fashion,Madison Harding,Madison Harding,TRUE,
AVpe_htmilAPnD_xSjdn,Wanted Babe Women  Moc Toe Synthetic  Oxford,50,FALSE,,Synthetic,,,WANTED,Wanted,TRUE,
AVpe_hwAilAPnD_xSjeY,'betty' Slipper (women),37.95,FALSE,,,,,patricia green,,FALSE,
AVpe_i_91cnluZ0-bhJ9,Indigo Rd. Leana Women  Round Toe Synthetic  Over The Knee Boot,99,FALSE,Brown,Synthetic,,,Indigo Rd.,Indigo Rd.,TRUE,
AVpe_i0qLJeJML43z_kC,Muk Luks Women's Fairisle Amira Slipper,16.99,FALSE,,,,,MUK LUKS,,FALSE,
AVpe_IAx1cnluZ0-bYJ7,Chelsea & Zoe Womens Kaarina Pointed Toe Ankle Fashion Boots,44.59,FALSE,,,,Formal,Chelsea & Zoe,Chelsea & Zoe,TRUE,
AVpe_iMBilAPnD_xSjo9,'milla' Pump,1095,FALSE,,,,,Christian Louboutin,,FALSE,
AVpfOrDTilAPnD_xXrRS,Yu&yu Women's Shoes Round Toe Chunky Heel Oxfords Shoes More Colors Available,86.76,FALSE,"Yellow,Beige,Orange",,,,,Qianyuyu,FALSE,
AVpe_iU11cnluZ0-bg5t,"Ellie Shoes E-305-jesse, 3 Heel Clear Mule With Rhinestones. Clear 15""",62.96,FALSE,Clear,,,,ELLIE SHOES,ELLIE SHOES,FALSE,
AVpe_j_q1cnluZ0-bhhr,Dyeables Poppy Women D Pointed Toe Synthetic Silver Slingback Heel,110,FALSE,,Synthetic,,,Dyeables,Dyeables,TRUE,
AVpe_JO1ilAPnD_xSbSz,Ellie Women's 'Leelo-527' Dual Platform Stiletto Heels,116.99,FALSE,"Black,White,Black White",,,,Ellie,,TRUE,China
AVpe_JY-LJeJML43z3Bf,Franco Sarto Colletta   Open Toe Leather  Wedge Heel,85,FALSE,Brown,Leather,,,Franco Sarto,Franco Sarto,TRUE,
AVpe_KALilAPnD_xSbi9,Blowfish Women's Demure Nat Sunburst Crochet Ankle-high Fabric Flat Shoe - 7.5m,39.59,FALSE,,,,Casual,Blowfish,Blowfish,FALSE,
AVpe_k-B1cnluZ0-bh4g,Muk Luks174 Women's Pink Allison Wedge Sandals,43.95,FALSE,"Pink,Charcoal",,,Casual,MUK LUKS174,,TRUE,
AVpe_kgCilAPnD_xSkfz,"Touch Ups Womens Ashley Sandal,gold,11 M Us",38.14,FALSE,Gold,,,,Touch Ups,,FALSE,
AVpe_KG-ilAPnD_xSblM,Propet Scuff - Slipper - Women's - Cinnamon,43.95,FALSE,"Brown,Cinnamon",,,,Propet,,FALSE,
AVpe_Kj4LJeJML43z3aQ,Michael Michael Kors Women's Wendy Mid Heel Strappy Sandals,54.99,FALSE,"Black,Natural",Leather,,Wear to Work,MICHAEL Michael Kors,MICHAEL Michael Kors,TRUE,
AVpe_knA1cnluZ0-bhvt,Michael Michael Kors Natalia Wedge Women Us 11 White Pre Owned Blemish 1650,29.99,FALSE,White,Leather,,,Michael Michael Kors,,TRUE,
AVpe_kNBilAPnD_xSkYv,Corso Como Women's Flounder Flat,30.58,FALSE,,,,,Corso Como,Corso Como,FALSE,
AVpe_KSZ1cnluZ0-bY5y,Flip Iii Shoe - Women's,23.34,FALSE,,,,,Chassé,,FALSE,
AVpff4VBLJeJML43-Qy7,Yu&yu Women's Shoes Pointed Toe Flat Heel Flats Shoes More Colors Available,128.18,FALSE,"Black,Gold,Silver",,,,,Qianyuyu,FALSE,
AVpe_kygLJeJML430ARg,J Shoes King Cobra   Open Toe Leather  Sandals,109,FALSE,,Leather,,,J Shoes,J Shoes,TRUE,
AVpe_kZDilAPnD_xSkdO,Yu&yu Women's Shoes Round Toe Low Heel Loafers Shoes More Colors Available,112.15,FALSE,"White,Black,Brown",,,,,Qianyuyu,FALSE,
AVpe_l_ILJeJML430AtS,Caparros Pandora   Open-toe Synthetic  Slingback Sandal,69,FALSE,Silver,Synthetic,,,Caparros,Caparros,FALSE,
AVpfLW4KilAPnD_xWl5M,Yu&yu Women's Shoes Round Toe Flat Heel Loafers Shoes More Colors Available,71.27,FALSE,"Red,Black,Navy,Yellow",,,,,Qianyuyu,FALSE,
AVpe_leS1cnluZ0-biEc,Brinley Co. Womens Comfort Sole Round Toe Pumps,29.99,FALSE,"Black Suede,Navy Suede",Fabric,,,Brinley Co.,Brinley Co,FALSE,
AVpe_LKw1cnluZ0-bZNT,Calvin Klein Zizi Women  Open Toe Suede Black Slides Sandal,89,FALSE,,Suede,,fashion,Calvin Klein,Calvin Klein,TRUE,
AVpe_lkxLJeJML430Ak9,Grasshoppers Prospect Clog Women  Round Toe Suede Gray Mules,50,FALSE,,Suede,,,Grasshoppers,Grasshoppers,TRUE,
AVpe_M05LJeJML43z4Kn,Vince Patton   Round Toe Suede  Sneakers,250,FALSE,,Suede,,athletic,Vince,Vince,FALSE,
AVpe_mSiilAPnD_xSlI7,Lamo Women's Britian Mc Ii Moccasin,31.99,FALSE,"Black,Grey,Pink,Chocolate,Chestnut",Suede,,,Lamo Sheepskin Inc,Lamo Sheepskin Inc,FALSE,
AVpe_mv7LJeJML430A-M,Hades Langdon-blk-11 Langdon Shoe - Black - Size  11,320.58,FALSE,,,,,Hades,,FALSE,
AVpe_MYWLJeJML43z4A1,Nina Women's 'Carrie' Synthetic Dress Shoes by Nina,51.99,FALSE,Silver,,,,Nina,,TRUE,China
AVpe_mzb1cnluZ0-biiL,Nine West Vintage America Collection Vermillion Brown Womens Shoes 11 M Boots,79.5,FALSE,Browns,Leather,,,Nine West Vintage America Collection,,FALSE,
AVpe_nuXilAPnD_xSlod,New Balance Ww496 Women Us 9 White Walking Shoe,44.99,FALSE,White,Synthetic,New with box,,New Balance,,FALSE,
AVpe_OiI1cnluZ0-baVv,Ellie 821-vanity Women  Open Toe Synthetic  Platform Heel,70,FALSE,Clear,Synthetic,,dress,Ellie,Ellie,TRUE,
AVpe_oWSLJeJML430Bf9,Easy Spirit Peregrine Women  Round Toe Suede Gray Sneakers,69,FALSE,,Suede,,,Easy Spirit,Easy Spirit,FALSE,
AVpe_paCLJeJML430B5G,'kate' Ankle Strap Sandal (women),695,FALSE,,,,,Saint Laurent,,FALSE,
AVpe_PKS1cnluZ0-baj8,"Plus Size Pirate Boot, 3 3/4''",27.33,FALSE,Black Pu,,,,"Pleaser USA, Inc.",PleaserUSA,FALSE,
AVpe_pwXLJeJML430CA3,Chelsea Crew Helena Women's Chunky Mary Jane Pumps Dress Shoes,70,FALSE,,,,,Chelsea Crew,,TRUE,
AVpe_qTKLJeJML430CNk,Bearpaw Women's Begonia Coral Ankle-high Fabric Sandal - 6m,33.8,FALSE,,,,Fashion,Bearpaw,Bearpaw,FALSE,
AVpe_R8TLJeJML43z51x,Df By Dearfoam Women's Cable Knit Scuff Slipper,12.98,FALSE,Grey,,,,DF by Dearfoams,,FALSE,
AVpe_rA1ilAPnD_xSmyZ,Yu&yu Women's Shoes Round Toe Chunky Heel Oxfords With Lace-up Shoes More Colors Available,126.18,FALSE,"Red,Black,Beige,Brown",,,,,Qianyuyu,FALSE,
AVpe_RQVilAPnD_xSd8G,Badgley Mischka Meghan   Open-toe Canvas  Slingback Heel,260,FALSE,Silver,Canvas,,,Badgley Mischka,Badgley Mischka,TRUE,
AVpe_rtiilAPnD_xSnC5,Toms Classic Wedge Women Us 8 Black Wedge Sandal Pre Owned 1654,39.99,FALSE,Black,Canvas,,,Toms,,TRUE,
AVpe_RxrLJeJML43z5yK,'cactus' Mary Jane Flat (women),49.95,FALSE,,,,,Simple,,FALSE,
AVpe_RyCilAPnD_xSeG6,Nine West Women's Size 12 White Leather Wedge Sandals,24.99,FALSE,White,Leather,New with box,,Nine West,,FALSE,
AVpe_-rYilAPnD_xStsc,Dv By Dolce Vita Women's Nanette Tribal Print Calf Hair Sandal,40.59,FALSE,,,,,DV by Dolce Vita,DV by Dolce Vita,FALSE,
AVpe_-RzLJeJML430JWQ,Zigi Soho Advice   Open Toe Canvas  Thong Sandal,50,FALSE,,Canvas,,fashion,Zigi Soho,Zigi Soho,TRUE,
AVpe_sEaLJeJML430C2v,'my Muse' Pump,425,FALSE,,,,,Salvatore Ferragamo,,FALSE,
AVpe_sM4LJeJML430C5w,Talitha Suede Boot,1250,FALSE,Black,,,,Ralph Lauren,,FALSE,
AVpe_SP4ilAPnD_xSeQ9,Lauren By Ralph Lauren New Ryan Black Womens Shoes Size 7.5 M Sandals Msrp $125,30,TRUE,Blacks,,,,Lauren by Ralph Lauren,,TRUE,
AVpe_Tp61cnluZ0-bcA2,Mia Girl Women's  Basket Espadrille Wedge Sandal,59,FALSE,"Cognac,White",Synthetic,,casual,Mia,MIA,TRUE,
AVpe_tsbilAPnD_xSnvI,Toms Women's Alpargata Vintage Canvas Navy/multi Ankle-high Canvas Flat Shoe - 5.5m,39.15,FALSE,NavyMulti,,,,TOMS,Toms,FALSE,
AVpe_tZZilAPnD_xSnoQ,Diane Von Furstenberg Women's Valentina Dress Sandal,350,FALSE,,,,,Diane von Furstenberg,,FALSE,
AVpe_uAULJeJML430Di_,Adult Gogo Boots Choice of Colors,29.65,FALSE,"Multi-Colored,Pink","Upper Material||PATENT POLYURETHANE , Heel Material||ABS (Plastic)",,,ELLIE SHOES,ELLIE SHOES,FALSE,
AVpe_UGuLJeJML43z6kG,Keds Women's Champion Distressed Sneaker,89.38,FALSE,"Tan,Green,Graphite,Navy",,,,,Sperry Top-Sider,FALSE,
AVpe_urTLJeJML430Dwg,Women's Skechers Energy Burst Equinox Bungee Lace Shoe Charcoal/Coral by Skechers,62.95,FALSE,,,,,Skechers,,FALSE,United States
AVpe_UTu1cnluZ0-bcOs,Tredsafe Women's Sara Grey  Slip Resistant Shoe,22.82,FALSE,Grey,,,,Tredsafe,,FALSE,
AVpe_uvd1cnluZ0-blS5,Yu&yu Women's Shoes Comfort Flat Heel Leather Loafers Shoes More Colors Available,210.31,FALSE,"Camel,Brown",,,,,Qianyuyu,FALSE,
AVpe_UxyLJeJML43z6yV,Ellen Tracy Womens Black Suede Leather High Heel Pumps Shoes Bow New Harlow 6.5,19,FALSE,Blacks,Suede,New without box,,Ellen Tracy,,TRUE,
AVpe_V8hilAPnD_xSfd3,2 Lips Too Too Demand   Open Toe Synthetic  Wedge Heel,40,FALSE,Black,Synthetic,,,2 Lips Too,2 Lips Too,FALSE,
AVpe_VcL1cnluZ0-bclx,"Easy Spirit Womens Murano Suede Square Toe Ankle Fashion Boots, Brown, Size 9.0",56.99,FALSE,,,,Casual,Easy Spirit,Easy Spirit,TRUE,
AVpe_vHHLJeJML430D5_,"Sneed- Customizable Women's Dance Shoes Latin Sparkling Glitter Customized Heel Silver/gold, Silver-us6.5-7 / Eu37 / Uk4.5-5 / Cn37 , Silver-us6.5-7 / Eu37 / Uk4.5-5 / Cn37",70,FALSE,,,,,,SNEED,FALSE,
AVpe_vIALJeJML430D6Z,Blowfish Women's Hiro Whiskey Dcpu Ankle-high Synthetic Sandal - 8m,39.12,FALSE,,,,,Blowfish,Blowfish,FALSE,
AVpe_W2uilAPnD_xSfxj,Dune London Women Harah Silver Leather Jewelled Block Heel Sandal Sz 7m/38 $125,39.99,FALSE,Silver,Leather,New with box,,Dune London,,FALSE,
AVpe_W5yLJeJML43z7eP,Aerosoles Nuwlywed   Round Toe Leather  Loafer,35.34,FALSE,"Dark Silver Leather,White,Dark Tan Leather,Grey,Blue Combo,Gray",Leather,,Casual,Aerosoles,Aerosoles,TRUE,
AVpe_W7q1cnluZ0-bdDV,A1650 - Vans Authentic Lo Pro Shoes * New Womens Size 8 Cosmic Galaxy - #25682,39.66,FALSE,Multi-Color,Textile,New with box,,Vans,,FALSE,
AVpe_xEE1cnluZ0-bmD6,Micahel Kors Dress Black Heel Womens Size 10 M New $197,24.99,FALSE,Black,Leather,New with defects,,Micahel Kors,,FALSE,
AVpe_xFN1cnluZ0-bmEg,Nine West Abrial Women  Round Toe Suede  Ankle Boot,120,FALSE,,Suede,,,Nine West,Nine West,FALSE,
AVpe_XhoilAPnD_xSgAF,Karen Scott Clancy Women  Pointed Toe Synthetic Brown Heels,40,FALSE,Brown,Synthetic,,dress,Karen Scott,Karen Scott,TRUE,
AVpe_x-jilAPnD_xSpLq,Dyeables Dee   Open Toe Canvas  Wedge Sandal,100,FALSE,,Canvas,,,Dyeables,Dyeables,TRUE,
AVpe_XL2LJeJML43z7kA,"Sneed- Customizable Women's Dance Shoes Latin/salsa Satin Customized Heel Black/blue/yellow/pink/purple/red/white/fuchsia, Pink-us9 / Eu40 / Uk7 / Cn41 , Pink-us9 / Eu40 / Uk7 / Cn41",88,FALSE,,,,,,SNEED,FALSE,
AVpe_XN7ilAPnD_xSf5S,Michael Michael Kors Keaton Slip On Women Us 9 Black Loafer Pre Owned 1905,34.99,FALSE,Black,Suede,,,Michael Michael Kors,,TRUE,
AVpe_yeu1cnluZ0-bmkF,G Antini Women's Rivet Decor High Heels Pointed Ankle Strap Pumps (size 7.5),57.99,FALSE,,100% PU,,,G Antini,,FALSE,
AVpe_yM91cnluZ0-bmdW,Oofos Unisex Adult Ooriginal Thong Sandals,44.95,FALSE,Fuschia,,,,Oofos,Oofos,FALSE,
AVpe_yZ-ilAPnD_xSpVd,Fratelli Rossetti Artic Women  Round Toe Canvas  Sneakers,550,FALSE,,Canvas,,athletic,Fratelli Rossetti,Fratelli Rossetti,FALSE,
AVpe_z63ilAPnD_xSp3n,Women's Walking Cradles Faye Black Leather,49.99,FALSE,,,,,Walking Cradles,,TRUE,
AVpe_zFS1cnluZ0-bmyS,Clarks Womens Bavette Cathy Black Leather 12395 Mary Jane Pumps Shoes Size 8 M,23.99,FALSE,Black,Smooth Leather,,,Clarks Collection,,TRUE,
AVpe_ZsR1cnluZ0-bd8R,Qupid Tustin 08 Women  Open Toe Synthetic Tan Wedge Heel,60,FALSE,,Synthetic,,,Qupid,Qupid,FALSE,
AVpe_Zuw1cnluZ0-bd8s,Tenth Frame Neon Women's Bowling Shoes,38.95,FALSE,"Green,Yellow,YellowGreenOrange,Orange",,,,Tenth Frame,,FALSE,
AVpe_ZVJilAPnD_xSgks,"Sneed- Women's Dance Shoes Latin Satin Chunky Heel Black, Black-us5 / Eu35 / Uk3 / Cn34 , Black-us5 / Eu35 / Uk3 / Cn34",68,FALSE,,,,,,SNEED,FALSE,
AVpe-0Aq1cnluZ0-bQ3U,Dv By Dolce Vita Odetta Women Us 7 Blue Heels Pre Owned 1661,17.99,FALSE,Blue,Suede,,,DV By Dolce Vita,,TRUE,
AVpe-0F4LJeJML43zvWi,Janis Slip-on Sneaker,49,FALSE,"Black,Turquoise,Pink,Navy",,,,Ralph Lauren,,FALSE,
AVpe-0U9ilAPnD_xSTyK,Pikolinos 801-9513f Women Boots,210,FALSE,Black,,,,Pikolinos,,FALSE,
AVpe-16y1cnluZ0-bRin,Metaphor Women's Dress Sandal Ramona - Pewter,34.99,FALSE,"Champagne,Black",,,,Metaphor,,TRUE,
AVpe-1Q21cnluZ0-bRT8,The Flexx Bow Commotion Women  Peep-toe Leather  Flats,100,FALSE,Black,Leather,,,The Flexx,The Flexx,TRUE,
AVpe-2AiLJeJML43zwCU,Coconuts By Matisse Zanda Women Us 9 Black Gladiator Sandal,62,FALSE,,Synthetic,,,Coconuts by Matisse,,TRUE,
AVpe-30jLJeJML43zwsb,Michael Kors Saylor Women's Ankle Boots Booties Leather,225,FALSE,"Brown,Luggage",Leather,,,Michael Kors,,TRUE,
AVpe31i7LJeJML43xJ5F,Fs/ny Quench Women  Round Toe Leather  Flats,195,FALSE,Orange,Leather,,,FS/NY,FS/NY,TRUE,
AVpe32bSLJeJML43xKRU,Toms Women's Classic Slip-on,39.94,FALSE,,Suede,,,TOMS,TOMS,FALSE,
AVpe338KLJeJML43xK7b,Nike Women's Fs Lite Run 2 Ankle-high Mesh Tennis Shoe,75,FALSE,,,,,Nike,Nike,FALSE,
AVpe338QilAPnD_xPvfY,Vans Asher Women  Round Toe Canvas Green Sneakers,50,FALSE,Green,Canvas,,,VANS,VANS,FALSE,
AVpe33njilAPnD_xPvWX,Women's Rieker-Antistress Louise 52173 Testadimoro/Rubino by Rieker-Antistress,119.95,FALSE,,,,,Rieker-Antistress,,TRUE,United States
AVpe34rbilAPnD_xPvzZ,$125 Dansko Professional Leather Clogs In Hickory Cabrio Eu 40 Us 9.5-10,55.25,TRUE,Brown,Leather,,Wear to Work,Dansko,,TRUE,
AVpe35f1ilAPnD_xPwJZ,Rampage Jellie   Open-toe Synthetic  Slingback Sandal,40,FALSE,Black,Synthetic,,,Rampage,Rampage,TRUE,
AVpe35U91cnluZ0-Ys22,Principle Plastics Sloggers Women's Black Leaf Print Rain & Garden Shoes,32.99,FALSE,,,,,Principle Plastics,,FALSE,
AVpe35X81cnluZ0-Ys4i,Nine West Women's Ancy Wedge Flip-flop Sandals,24.59,FALSE,,,,,Nine West,Nine West,FALSE,
AVpe35YAilAPnD_xPwGA,Carolina Panthers Women's Colorblock Fur Slide Slipper,21.99,FALSE,Carolina Panthers,,,,Forever Collectible,Forever Collectible,FALSE,
AVpe36K2ilAPnD_xPwcE,Gentle Souls Gail Women  Open Toe Leather  Slides Sandal,280,FALSE,"Grey,Gray",Leather,New,Everyday,Gentle Souls,Gentle Souls,TRUE,
AVpe36-r1cnluZ0-Ytki,Yu&yu Cow Leather Women's Flat Heel Comfort Pointed Toe Pumps Shoes (more Colors),114.15,FALSE,"White,Pink,Purple",,,,,Qianyuyu,FALSE,
AVpe37TjilAPnD_xPw6N,"Me Too Womens Flynn Leather Ballet Flat Shoe, Black Nappa, Us 8",89,FALSE,,Leather,,,Me Too,,TRUE,
AVpe38oaLJeJML43xM4x,Jessica Simpson Jozie Women  Open Toe Suede  Wedge Heel,79,FALSE,,Suede,,,Jessica Simpson,Jessica Simpson,FALSE,
AVpe39TG1cnluZ0-Yufk,Toms Women's Classic Canvas Ankle-high Canvas Flat Shoe,48,FALSE,"Aegean Blue Canvas,Navy Canvas,Light Grey Canvas,Picante Red Canvas,Red Canvas,Ash Canvas,Black Canvas,Natural Canvas",,,,TOMS,Toms,FALSE,
AVpe-3a21cnluZ0-bSGT,Thalia Sodi Fuerto 1   Open Toe Synthetic  Thong Sandal,59,FALSE,Pink,Synthetic,,,Thalia Sodi,Thalia Sodi,TRUE,
AVpe3gVLilAPnD_xPoyY,Women's SoftWalk Bellrider Too Black Smooth Leather,224.95,FALSE,"Black,Black Smooth Leather",,,,SoftWalk,,FALSE,
AVpe-3J9LJeJML43zwda,Isotoner Signature Women's Cheetah Microsuede Slippers,19.95,FALSE,,,,,Isotoner,ISOTONER,FALSE,
