id,name,price,onSale,color,material,condition,occasion,brand,manufacturer,hasHeels,countryOfOrigin
AVpf8vGQLJeJML43Gb_A,Easy Spirit Sahara Suede Slides Sandal,36.59,FALSE,"BlkMu,GreyMu",,,,Easy Spirit,Easy Spirit,FALSE,
AVpf8WrVLJeJML43GWFE,Women's VANELi Astyr Pump Black Miniliz Print by Vaneli,154.95,FALSE,,,,,Vaneli,,TRUE,United States
AVpf8wxwilAPnD_xk-iY,Faded Glory Women's Western Boot,16.97,FALSE,Black,,,,Faded Glory,,FALSE,
AVpf8z2pilAPnD_xk_WL,"Dr. Scholl's 8510 Womens Malinda Tan Riding Boots Shoes 6 Medium (b,m) Bhfo",18.5,FALSE,Coffee,Leather/Man Made,New with box,,Dr. Scholl's,,TRUE,
AVpf95jxLJeJML43Gt5a,Gx By Gwen Stefani Adams   Open Toe Synthetic  Sandals,110,FALSE,Black,Synthetic,,,GX by Gwen Stefani,GX by Gwen Stefani,TRUE,
AVpf9B9X1cnluZ0-uD1n,Superga Women's Dual Zipper Fashion Sneaker,50.02,FALSE,,,,,Superga,,FALSE,
AVpf9DauilAPnD_xlDSz,Marc Joseph Central Park   Round Toe Leather  Ballet Flats,165,FALSE,,Leather,,,Marc Joseph,Marc Joseph,TRUE,
AVpf9kHHilAPnD_xlLId,Kelly & Katie Isabel   Round Toe Synthetic  Heels,50,FALSE,,Synthetic,,,Kelly & Katie,Kelly & Katie,TRUE,
AVpf9QQBilAPnD_xlGbH,Andre Assous 'nice' Slide Sandal (women),88.95,FALSE,,,,,Andre Assous,,FALSE,
AVpf9RJxilAPnD_xlGqF,Puma Pulse Xt Pwrcool Women  Round Toe Synthetic Gray Sneakers,70,FALSE,"GreenWhite,Gray",Synthetic,,,PUMA,Puma,FALSE,
AVpf9th01cnluZ0-uN_x,Women's J203 Split Sole Jazz Shoe,29.5,FALSE,Caramel,,,,Dance Class,,FALSE,
AVpf9VK81cnluZ0-uIh7,Women's Rose Petals by Walking Cradles Lissa Ankle Strap Sandal New Nude Kid,129.95,TRUE,,,,,Rose Petals by Walking Cradles,,TRUE,Brazil
AVpf9xn9LJeJML43Gr61,Yu&yu Women's Shoes Peep Toe Flat Heel Satin Flats Shoes Matching Satin Evening Bag,226.33,FALSE,Red,,,,,Qianyuyu,FALSE,
AVpf9y4SilAPnD_xlOTq,Touch Ups Melanie Womens Silver Sandals 7.5 W,47.01,FALSE,,,,,Benjamin Walk,,FALSE,
AVpf9zYj1cnluZ0-uPcN,"Me Too Womens Lilyana Leather Ballet Flat Shoe, Navy Glazed Goat, Us 8.5",79,FALSE,,Leather,,,Me Too,,TRUE,
AVpfA_gT1cnluZ0-cB9g,Muk Luks Women's Kieran Slipper,40,FALSE,Blue,100% Polyester,,,MUK LUKS,Reliable of Milwuakee,FALSE,
AVpfa02r1cnluZ0-kb4_,Vince Camuto Carra Women  Pointed Toe Leather  Heels,110,FALSE,,Leather,,dress,Vince Camuto,Vince Camuto,TRUE,
AVpfA0lEilAPnD_xTA58,Beacon Cape Women Us 10 N/s Tan Fisherman Sandal,50,FALSE,,Leather,,,Beacon,,TRUE,
AVpfA0Ok1cnluZ0-b9_u,"Belle-301, 3'' Stiletto Heel Sandal",26.66,FALSE,Clear and Clear,,,,PleaserUSA,PleaserUSA,FALSE,
AVpfA0YfLJeJML430cnH,Pearl Faux Suede Stiletto High Heel Purple Court Shoes,69.98,FALSE,,Synthetic,,,,ShuWish UK,FALSE,
AVpfA1581cnluZ0-b-iq,Nwb Nine West Optimistic (women's) Size 10 M Wedge Heel Booties,64.99,FALSE,Black,Leather,New with box,,Nine West,,FALSE,
AVpfa1nK1cnluZ0-kcE9,"Genuine Grip 470-5w Work Shoes, Womens, 5w, Blk, Slip On, Pr",53.98,FALSE,,,,,Genuine Grip,Genuine Grip,FALSE,
AVpfA2of1cnluZ0-b-zD,Jessica Simpson Colver   Round Toe Suede  Bootie,73.99,FALSE,Beige,Suede,,,Jessica Simpson,Jessica Simpson,TRUE,
AVpfA2QPilAPnD_xTBcV,Naot Womens Matai Shoes - Koru Bed - Black Size 38,19.99,FALSE,Black Madras,leather & suede,,,Naot Footwear,,FALSE,
AVpfA2V9ilAPnD_xTBeT,'ida' Sandal (women),1100,FALSE,,,,,MALONE SOULIERS,,FALSE,
AVpfA3SLilAPnD_xTByb,Bruno Magli Ballet Flats Dina Patent Leather Black Womens Shoes Sz 7 New,169.99,FALSE,Black,,New with box,,Bruno Magli,,TRUE,
AVpfA4Pi1cnluZ0-b_W6,Coconuts By Matisse Women's Chico Tan Slingback Sandal,77,FALSE,Tan,,,Casual,Coconuts by Matisse,,TRUE,
AVpfA4PrilAPnD_xTCIg,Bearpaw Women's Rosie Dark Honey Ankle-high Sheepskin Boot - 7m,54.4,FALSE,"Hickory,Dark Honey",,,Cold Weather,Bearpaw,Bearpaw,FALSE,
AVpfA4ze1cnluZ0-b_jp,Tommy Hilfiger Malenita Women Us 9.5 Black Loafer,89,FALSE,,Leather,,,Tommy Hilfiger,,TRUE,
AVpfA5iJilAPnD_xTCm-,Coloriffics Elana Women Us 9.5 Gold Heels,150,FALSE,,Synthetic,,,Coloriffics,,TRUE,
AVpfa5Ko1cnluZ0-kdC7,Dunhu Delicate Patent Pu Pretty Little Young Lady's Oxfords,148,FALSE,"Red,Black",,,,DUNHU,,FALSE,
AVpfA68K1cnluZ0-cAVD,Calvin Klein Marlie Women  Open Toe Patent Leather  Slides Sandal,139,FALSE,,Leather,,,Calvin Klein,Calvin Klein,FALSE,
AVpfA6lpLJeJML430ezA,Yu&yu Women's Shoes Wedge Heel Round Toe Fashion Sneakers Casual Black/pink/purple,86.76,FALSE,"Fuchsia,Black,Purple",,,,,Qianyuyu,FALSE,
AVpfA6RGilAPnD_xTC3Q,Handcrafted Cotton 'Green Thai Holiday' Batik Dress (Thailand),34.99,TRUE,Green,,,,Novica,,FALSE,
AVpfA6xV1cnluZ0-cASe,Nina Bettina Women  Open Toe Synthetic Gold Sandals,48.99,FALSE,Gold,Synthetic,,,Nina,Nina,TRUE,
AVpfA77RLJeJML430fPZ,Journee Collection Women's Plush Printed Slipper Socks by Journee Collection,18.39,FALSE,"Green,Pink,Purple,White",,,,Journee Collection,,FALSE,China
AVpfa7y51cnluZ0-kdx1,U.s. Polo Assn.(women's) Women's Stacy Boat Shoe,39.99,FALSE,,,,,U.S. Polo Assn.,,FALSE,
AVpfA7YYilAPnD_xTDOi,Touch Ups Maddy   Open-toe Synthetic  Heels,72,FALSE,,Synthetic,,,Touch Ups,Touch Ups,TRUE,
AVpfa8VIilAPnD_xbewg,Pearl Izumi Road M2   Round Toe Synthetic  Cross Training,195,FALSE,Dazzling BlueBlack,Synthetic,,,Pearl Izumi,Pearl Izumi,FALSE,
AVpfa8x2LJeJML4387hK,"Dearfoams Size Xlarge Womens Microfiber Velour Faux Fur Cuff Clog Slipper, Black",26,FALSE,,,,,Dearfoams,Dearfoams,FALSE,
AVpfA91xilAPnD_xTEGQ,Toms Women's Nepal Oxford Tan Suede Faux Hair Mid-calf Suede Boot - 8m,71.64,FALSE,,,,,TOMS,Toms,FALSE,
AVpfA9g4LJeJML430fzP,"Toms Womens Classic Mesh Slip On Casual Shoe, Silver, Us 7.5",59,FALSE,,,,,TOMS,,FALSE,
AVpfA9ZjilAPnD_xTD7f,Propet Corinne Xt - Rejuve - Women's Sandals - Silver/grey,65.96,FALSE,Silver,,,,Propet,,FALSE,
AVpfAA181cnluZ0-brrL,Missoni Um055g Womens Fabric Pumps Heels Shoes,485,FALSE,Orange,,,,Missoni,,FALSE,
AVpfAAgwilAPnD_xSuV_,Fidji V136   Open Toe Leather  Sandals,184,FALSE,,Leather,,,Fidji,,TRUE,
AVpfaAtn1cnluZ0-kOIU,Sidekicks Women's Foldable Patent Ballet Flats by SIDEKICK,26.99,FALSE,"Black,Purple,Red,Tan",,,,SIDEKICK,,FALSE,China
AVpfAaugilAPnD_xS3vC,"Billabong Womens Ps Beach Dunes Slip On Sandal Shoe, Cognac, Us 9",44.95,FALSE,,Leather,,,Billabong,,TRUE,
AVpfAaWPLJeJML430TUp,Famous Name Brand Elaina Women Us 7 Gold Open Toe Slingback Sandal,60,FALSE,,Synthetic,,,FAMOUS NAME BRAND,,TRUE,
AVpfAB1OLJeJML430Kk-,Under Armour Women's Jet Mid Basketball Shoes,69.99,FALSE,,,,,Under Armour,,FALSE,
AVpfAB2N1cnluZ0-bsCj,R.b.l.s. Siam   Round Toe Synthetic  Boot,80,FALSE,Black,Synthetic,,,r.b.l.s.,r.b.l.s.,TRUE,
AVpfAb391cnluZ0-b1Y8,Minnetonka Women's Cally Slipper Moccasin,38.95,FALSE,,,,,Minnetonka,Minnetonka,FALSE,
AVpfaBL71cnluZ0-kOQ3,In-Sattva Women's Indian Chevron Print Patiala Pants (India) by In-Sattva,34.49,FALSE,,,,,In-Sattva,,FALSE,India
AVpfABqV1cnluZ0-br-b,Calvin Klein Veranic   Open Toe Leather  Sandals,119,FALSE,Gray,Leather,,fashion,Calvin Klein,Calvin Klein,TRUE,
AVpfABRWLJeJML430KXn,Yu&yu Women's Shoes Round Toe Platform Oxfords Shoes More Colors Available,126.18,FALSE,"White,Black",,,,,Qianyuyu,FALSE,
AVpfabSFLJeJML438yUj,Dr. Scholl's Womens Storm Leather Work Athletic Shoes,37.99,FALSE,Black,Leather/Man Made,,,Dr. Scholl's,Dr. Scholl's,TRUE,
AVpfAbyt1cnluZ0-b1W7,Rampage Womens Wamblee Pointed Toe Mid-calf Cowboy Boots,32.99,FALSE,"TPE TUMBLED PU,Dark Brown,Red Tumbled PU,Black,Blue Grey",,,Casual,Rampage,Rampage,TRUE,
AVpfAc2iilAPnD_xS4gP,Alegria Women's Khloe Slip-on,129.95,FALSE,,,,,Alegria,,FALSE,
AVpfacB2ilAPnD_xbV0N,Bongo Women's Ava Brown Slouch Knee-high Fashion Boot,59.99,FALSE,Brown,,,Casual,Bongo,,TRUE,
AVpfAcNXLJeJML430UA3,Volcom Buzz Shoe Women Us 5 Tan Sneakers,60,FALSE,,Leather,,,Volcom,,FALSE,
AVpfaCV-ilAPnD_xbPSX,Alfani Anconna   Round Toe Suede  Ankle Boot,89,FALSE,Green,Suede,,,Alfani,Alfani,FALSE,
AVpfAD0PLJeJML430LSE,G By Guess Headliner   Round Toe Synthetic  Knee High Boot,99,FALSE,,Synthetic,,,G BY GUESS,G By Guess,TRUE,
AVpfAD741cnluZ0-bsx5,Carrini Ca Collection Women's Fashion Lace-up Heeled Boots,38.88,FALSE,"Black,Wheat",,,,Carrini,,FALSE,
AVpfadDE1cnluZ0-kVUG,Splendid Solvang   Round Toe Suede  Sneakers,78,FALSE,,Suede,,,Splendid,Splendid,FALSE,
AVpfAddg1cnluZ0-b18l,2 Pairs Dr. Scholl's Circulation Comfort Over The Calf Black Shoe Size 10.5-12,11.99,FALSE,Black,,,,Dr. Scholl's,,FALSE,
AVpfADe21cnluZ0-bsn2,New Balance 1105 Black Toning Womens Shoes Size,125,FALSE,Black,,,,New Balance,,FALSE,
AVpfADFU1cnluZ0-bsfA,Bordello Wink-01   Open Toe Synthetic  Platform Sandal,50,FALSE,,Synthetic,,,Bordello,Bordello,FALSE,
AVpfADi_ilAPnD_xSvbR,Mizuno Wave Creation 15 (w) Women's Shoes Size,124.6,FALSE,WhiteYellowPurple,,,,Mizuno,,FALSE,
AVpfADlLLJeJML430LMt,Daniel Green Women's Glamour Bedroom Slipper,60,FALSE,"Bone,Gold,Black,Pewter",,,,Daniel Green,,FALSE,
AVpfADmWLJeJML430LNI,Nina Angeline Women  Open Toe Suede Tan Wedge Heel,34.99,FALSE,Beige,Suede,,,Nina,Nina,FALSE,
AVpfADUe1cnluZ0-bskf,Calvin Klein Lana Women Us 9 Black Heels Pre Owned 1979,12.99,FALSE,Black,Leather,,,Calvin Klein,,TRUE,
AVpfADXsLJeJML430LIu,Vans Unisex Style 36 Slim Sneakers,64.99,FALSE,,,,,VANS,,FALSE,
AVpfAE1mLJeJML430Lqk,Michael Kors Womens 40s5ofp1l Leather Closed Toe Casual Slide Sandals,75.39,FALSE,LEATHER,,,Casual,Michael Kors,Michael Kors,FALSE,
AVpfAE85ilAPnD_xSv8B,Vionic Sara Women  Round Toe Leather  Mary Janes,119.95,FALSE,,Leather,,,Vionic,Vionic,FALSE,
AVpfAEDjilAPnD_xSvml,'espana' Fringe Suede Bootie (women),104.95,FALSE,,,,,COCONUTS BY MATISSE,,FALSE,
AVpfAeGXilAPnD_xS47j,Yu&yu Women's Shoes Round Toe Flat Heel Oxfords Shoes,77.46,FALSE,White,,,,,Qianyuyu,FALSE,
AVpfAeyEilAPnD_xS5Mh,Charles David Regalia Women  Open Toe Leather Orange Wedge Heel,195,FALSE,,Leather,,,Charles David,Charles David,FALSE,
AVpfAf2VilAPnD_xS5kB,Via Spiga Candace Women  Open Toe Synthetic  Platform Heel,200,FALSE,Brown,Synthetic,,,Via Spiga,Via Spiga,TRUE,
AVpfAfcGilAPnD_xS5bF,Mezzo Badra  W Open Toe Synthetic  Slides Sandal,95,FALSE,Silver,Synthetic,,,Mezzo,Mezzo,TRUE,
AVpfAFKPLJeJML430Lx-,Kate Spade Keds Gold Limited Edition Glitter Sneakers 9 Kick Shoes Black Rare !,149.97,FALSE,Gold,Glitter,New with box,,kate spade,,TRUE,
AVpfAfMULJeJML430VDh,Bed Stu Cheshire Women Us 11 Black Mid Calf Boot Pre Owned Blemish 1654,67.99,FALSE,Black,Leather,,,Bed Stu,,TRUE,
AVpfAF-P1cnluZ0-bth3,Bearpaw Boots Womens Constance Rainboot Rubber Ditch 1852w,69.99,FALSE,"White Snake,Natural Snake,Black Snake,Natural Snake Print",,,,Bearpaw,Bearpaw,FALSE,
AVpfAFpMLJeJML430L9N,Lugz Women's Zen LO Black Mid-Calf Boots by Lugz,78.95,FALSE,Black,,,,Lugz,,TRUE,China
AVpfAfPY1cnluZ0-b2lg,Vikky Marl High Tops,65,FALSE,,,,,Puma,,FALSE,
AVpfAG98ilAPnD_xSwoz,Dansko Women's Sonja Black Patent Clog 427-020200 Size Eu 37,89.99,FALSE,,,New with box,,Dansko,,FALSE,
AVpfagkCilAPnD_xbXAl,Ddi Women's Bamboo Style Flip Flops With Vinyl Straps Case Pack 72 - 378088,132.44,FALSE,,,,,Ddi,,FALSE,
AVpfAgoV1cnluZ0-b3F3,Bandolino Baruca Women Ivory Sandals,34.19,FALSE,"MEDPURP SY,OffWhit",,,,Bandolino,Bandolino,FALSE,
AVpfAGZb1cnluZ0-btqh,Charles By Charles David Drew Women  Pointed Toe Leather  Heels,99,FALSE,Multicolor,Leather,,,Charles By Charles David,Charles By Charles David,TRUE,
AVpfAH3ZLJeJML430Muw,Blue Women`s Yamary Mid-calf Boots by Blue,36.49,FALSE,"Black,Grey",,,,Blue,,TRUE,China
AVpfAH4lilAPnD_xSw9s,Olukai Paniolo Sandal - Women's Natural / Natural 8,84.99,FALSE,,,,,OluKai,OluKai,FALSE,
AVpfaH6pilAPnD_xbQnq,Vikky Winter High Tops,65,FALSE,Cashew-white,,,,Puma,,FALSE,
AVpfahHJ1cnluZ0-kWYC,Franco Sarto Women's Lizbeth Riding Boots,84.57,FALSE,"WhiskeyBr,BlackBrown,Brown",,,,Franco Sarto,Franco Sarto,FALSE,
AVpfAHK01cnluZ0-bt8R,Michael Michael Kors Winter Mid Boot Women Us 9 Black Pre Owned 1905,99.99,FALSE,Black,Suede,New with box,,Michael Michael Kors,,TRUE,
AVpfAHq01cnluZ0-buHh,"Totes Isotoner Size Xlarge Womens Embroidered Terry Ballerina Slippers, White",24,FALSE,,,,,Totes Isotoner,,FALSE,
AVpfAHZvLJeJML430Mkb,Womens New Balance Classics Traditionnels 574 Althetic Sneakers - Black/white,150,FALSE,,"Suede,Synthetic",,,New Balance,New Balance,TRUE,
AVpfAI_ZLJeJML430NI3,Toms Womens Classic Canvas Slip On Casual Shoe,48,FALSE,"Black,Natural,Black  Black",Canvas,,,TOMS,Toms,FALSE,
AVpfAI6ELJeJML430NG-,"Sneed- Customizable Women's Dance Shoes Latin/salsa Satin Customized Heel Black/blue/yellow/pink/purple/red/white/fuchsia, Nude-us8.5 / Eu39 / Uk6.5 / Cn40 , Nude-us8.5 / Eu39 / Uk6.5 / Cn40",88,FALSE,,,,,,SNEED,FALSE,
AVpfAI8ELJeJML430NH9,Jessica Simpson Women's Claudette D'orsay Pump,40.57,FALSE,"Alloy,Black",Patent Leather,,,Jessica Simpson,Jessica Simpson,TRUE,
AVpfAiaBLJeJML430WQc,Aerosoles Ride Around Wide Calf   Round Toe Synthetic  Knee High Boot,64.99,FALSE,Black,Synthetic,,Casual,Aerosoles,Aerosoles,TRUE,
AVpfAIhTilAPnD_xSxMW,Reebok Furylite Women's Shoes Size,75,FALSE,Tweed BrownBlackChalk,,,,Reebok,,FALSE,
AVpfAIhWilAPnD_xSxMX,Style & Co Tiffany Women Us 9.5 Ivory Open Toe Platform Heel,59,FALSE,,Synthetic,,,Style & Co.,,TRUE,
AVpfaII_LJeJML438tW0,Cotton Batik 'Bali Shadows' Dress (Indonesia) by Novica,84.99,FALSE,"Beige,Black,Yellow",,,Casual,Novica,,FALSE,Indonesia
AVpfAivzilAPnD_xS6oL,Muckboots Women's Breezy Low Boot,31.25,FALSE,"BrownFloral,AnkleHeightPurpleGingham,BlackFloral,AnkleHeightPinkGingham,BLKLILAC,BlueSunburst,COFFEEPINK,AnkleHeightBlackGingham,GreyGreenWhite",,,,Muck Boot,,FALSE,
AVpfa-iZLJeJML4387_Y,A.x.n.y. Anise Women  Round Toe Synthetic  Ankle Boot,55,FALSE,,Synthetic,,,a.x.n.y.,a.x.n.y.,TRUE,
AVpfAj1a1cnluZ0-b4Qn,Bcbg Max Azria Ma-powe Women  Open Toe Leather  Platform Heel,398,FALSE,,Leather,,,BCBG Max Azria,BCBG Max Azria,TRUE,
AVpfajbIilAPnD_xbXzG,Mohr Women's Black Solid/ Printed Reversible Vest (India) by In-Sattva,60.99,FALSE,Black,,,,In-Sattva,,FALSE,India
AVpfAJhVilAPnD_xSxjn,Olivia Miller Omm-9938 Women's Rhinestone Embellished T-strap Flat Thong Sandals,19.43,FALSE,"White,Black,Yellow",,,Casual,Olivia Miller,,TRUE,
AVpfAjkUilAPnD_xS68E,Sacha Calfskin Boot,1100,FALSE,"RL Gold,Black",,,,Ralph Lauren,,FALSE,
AVpfAJTw1cnluZ0-buui,Superfit Dia Women Canvas Winter Boot,150,FALSE,Black,,,,Superfit,,FALSE,
AVpfAK24LJeJML430Nzo,"Static Girls Toddler Fashion 7 Microsuede Boots With Jewels and Faux Fur""",25.95,FALSE,"Black,Camel,Purple",Synthetic,,,Static Footwear,Static Footwear,FALSE,
AVpfAk3ALJeJML430XJV,Miranda By Miranda Lambert Cowboy Women Round Toe Synthetic Silver Western Boot,80,FALSE,,Synthetic,,,Miranda By Miranda Lambert,Miranda By Miranda Lambert,TRUE,
AVpfAK74LJeJML430N1l,I Heart Collection Diana-03 Women's Stiletto Heel Caged Ankle Strap Dress Sandal,25.49,FALSE,"Black,Bronze,Silver",,,,I HEART COLLECTION,,TRUE,
AVpfakd6ilAPnD_xbYHM,Michael Michael Kors Women's Carla Platform Wedge Sandals,68.97,FALSE,"Cinder,Black,Navy",,,,MICHAEL Michael Kors,MICHAEL Michael Kors,TRUE,
AVpfAKMFilAPnD_xSxxo,Mtng Orignals Mtng Originals Nelva Eyelet Bootie Black High Heel Boots Shoes 54569 New 89,42,FALSE,Multi-color,,,,MTNG Orignals,,FALSE,
AVpfAKUTLJeJML430NmU,Mizuno Wave Lightning Rx3   Round Toe Synthetic  Running Shoe,120,FALSE,,Synthetic,,,Mizuno,Mizuno,FALSE,
AVpfakx21cnluZ0-kXbN,Anchors Aweigh Accent Your Summer Style (women's Flip Flops Large (8-9)),23.48,FALSE,,,,,Unique's Shop,Bigbolo,FALSE,
AVpfaLJn1cnluZ0-kQsU,"Toms Women's Classic Knit Casual Shoe (10 B (m) Us, Grey Black)",58.99,FALSE,Grey Black,Fux Fur,,,TOMS,,FALSE,
AVpfAlquLJeJML430Xbo,Rampage Martha   Round Toe Synthetic  Knee High Boot,50,FALSE,,Synthetic,,,Rampage,Rampage,TRUE,
AVpfALToLJeJML430N91,"Highest Heel Women's Shoes 6 Prism Platform and Heel Clear Vinyl Black Bottom""",70.74,FALSE,Clear  Black,,,,The Highest Heel,The Highest Heel,FALSE,
AVpfaMEtilAPnD_xbRpt,"Bejeweled-801, 8'' Heel, 4''  Slide Sandal",132.3,FALSE,,,,,PleaserUSA,PleaserUSA,FALSE,
AVpfaMTK1cnluZ0-kQ9c,Rebels 4720 Womens Dianne Black Leather Beaded Thong Sandals Shoes 10 Bhfo,16.25,FALSE,Black,Leather/Man Made,New with box,,Rebels,,TRUE,
AVpfaMvRLJeJML438uhw,Sz 10 New $428 Frye Jenna Cut Stud Black Leather Ankle Boots,159,FALSE,Black,Leather,New without box,,Frye,,TRUE,
AVpfan1i1cnluZ0-kYTO,Avia Avi-endeavor Women Us 10.5 White Sneakers,45,FALSE,,Synthetic,,,Avia,,FALSE,
AVpfANcrilAPnD_xSy-n,Yu&yu Women's Flat Heel Round Toe Flats Shoes (more Colors),63.97,FALSE,"Blue,Red,Black,Beige,Orange",,,,,Qianyuyu,FALSE,
AVpfaNDd1cnluZ0-kRKS,Daniel Green Elysa Women  Round Toe Synthetic Green Snow Boot,60,FALSE,,Synthetic,,,Daniel Green,Daniel Green,FALSE,
AVpfAngD1cnluZ0-b5j3,Wild Pair Lucerne   Open Toe Synthetic  Platform Sandal,40,FALSE,Green,Synthetic,,,Wild Pair,Wild Pair,TRUE,
AVpfANl4ilAPnD_xSzCR,Hailey Jeans Co. Women's 'Jennica' Buckle-Strap Mid-Calf Motorcycle Boots by Hailey Jeans Co.,23.99,FALSE,"Beige,Black,Brown,Black Brown Tan",,,,Hailey Jeans Co.,,TRUE,China
AVpfANR-ilAPnD_xSy7H,Vans Unisex Authentic Lo Pro Sneakers,65,FALSE,Orange - hotcoraltrwht,,,,VANS,,FALSE,
AVpfAnsgilAPnD_xS8ZP,Caparros Truly Women  Open-toe Synthetic  Slingback Heel,79,FALSE,Silver,Synthetic,,,Caparros,Caparros,FALSE,
AVpfAnY41cnluZ0-b5hb,New Balance Ww928 Women D Round Toe Leather  Sneakers,47.99,FALSE,Gray,Leather,,,New Balance,New Balance,FALSE,
AVpfAo2R1cnluZ0-b6Cz,Women's Fergie Footwear Inca Perforated Oxford Moonlight Perforated Suede,47.95,TRUE,"Madera Perforated Suede,Moonlight Perforated Suede",,,,Fergie Footwear,,TRUE,
AVpfAO33LJeJML430POf,Nine West No Game Women  Square Toe Leather  Mid Calf Boot,169,FALSE,Brown,Leather,,,Nine West,Nine West,TRUE,
AVpfAoakLJeJML430YYu,"New Jessica Simpson Size 10 Us Women's Shoes, Brown Leather - Nib",67.95,FALSE,brown,,New with box,,Jessica Simpson,,TRUE,
AVpfAOC71cnluZ0-bwbV,Rachel Avon Fabric Sandal Girls Childrens Shoes Purple Size 5,24.7,FALSE,Other,,,,Rachel,,FALSE,
AVpfAoDWLJeJML430YRX,Mephisto 9513 Womens Elenor Red Leather Lace Up Casual Fashion Sneakers 5 Bhfo,107.99,FALSE,Oxblood,Leather,New with box,,Mephisto,,TRUE,
AVpfAOfN1cnluZ0-bwkq,El Naturalista Womens N400 Cork Oak Wedge Sandal Shoes,145,FALSE,"Brown,Green,Lila,Optical,Skimo,Tibet",Leather,,,El Naturalista,El Naturalista,FALSE,
AVpfAoGf1cnluZ0-b5yE,Yellow Box Sutra Women Us 6 Multi Color Flip Flop Sandal,26.99,FALSE,,Canvas,,fashion,Yellow Box,Yellow Box,TRUE,
AVpfAolCLJeJML430Yc_,OP Women's Lace Eyelet EVA Sandal,7.98,FALSE,"Natural,Chambray",Fabric,,,Op,,FALSE,
AVpfAOn21cnluZ0-bwnP,Dizzy Dory Women  Open Toe Synthetic  Flip Flop Sandal,25,FALSE,Blue,Synthetic,,,Dizzy,Dizzy,TRUE,
AVpfAoT3LJeJML430YXr,Women's SoftWalk Hickory Oxford Luggage Veg Tumbled Leather,129.95,FALSE,"Sand Nubuck Leather,Mesh Fabric,Silverwash,Black Tumbled Leather,Distressed Nubuck",,,,SoftWalk,,TRUE,
AVpfAp0-ilAPnD_xS9K6,Via Pinky Women's Black Faux Leather Rhinestone Lace Up Chunky Military Combat Boots,39.99,FALSE,Black,,,,VIA PINKY,,TRUE,
AVpfAPJ0LJeJML430PUz,Onlycherry Women's Aalloy Sexy Solid Stiletto High Heels Dress Pumps,41.99,TRUE,"Red,Black",,,,Onlycherry,,FALSE,
AVpfapJCLJeJML4382FW,Women's Basic Slipper Bootie -exclusive Color,12.94,FALSE,"LIGHT PINK,NAVY",,,,Unbranded,,FALSE,
AVpfApjK1cnluZ0-b6T7,Women's Alpaca Wool 'Cuzco Grace' Sweater (Peru),74.99,FALSE,Black,,,Casual,Novica,,FALSE,
AVpfAPlk1cnluZ0-bw9C,Allegra K Women's Rounded Toe Chunky Platform Buckle Strap Pumps Red (size 8.5),70.99,FALSE,,Heel PU Outsole Rubber Vamp PU,,,G ANTINI,,FALSE,
AVpfAPSO1cnluZ0-bw2q,Luxury Rebel Maggie Women  Pointed Toe Leather Brown Bootie,220,FALSE,Brown,Leather,,,Luxury Rebel,Luxury Rebel,TRUE,
AVpfAPVkLJeJML430PY6,Dr. Scholl's Marlee Women  Round Toe Canvas Blue Ballet Flats,40,FALSE,Blue,Canvas,,,Dr. Scholl's,Dr. Scholl's,FALSE,
AVpfAq1O1cnluZ0-b6yG,Women's Propet Merlin Poppy by Propet,60.95,FALSE,Red,,,,Propet,Propet,TRUE,United States
AVpfaQb1ilAPnD_xbSwV,Nike Womens Wmns Nike Flex 2016 Rn,80,FALSE,,,,,Nike,Nike,FALSE,
AVpfAqDCilAPnD_xS9QC,Fiel Neptune Women Us 7.5 Gray Gladiator Sandal,210,FALSE,,Suede,,,FIEL,,TRUE,
AVpfaQdq1cnluZ0-kR_Y,Fla C3 Post Op Shoe W/microban Womens - Small,42.17,FALSE,Multicolor,Multi,,,FLA Orthopedics,FLA Orthopedics,FALSE,
AVpfNTpY1cnluZ0-gMnG,Yoki Sheila-05 Women  Open Toe Synthetic  Thong Sandal,13,FALSE,Green,Synthetic,,,Yoki,Yoki,TRUE,
AVpfaQn0LJeJML438vfz,Women's Dyeables Sage Ankle Strap Sandal Gold Shimmer by Dyeables,62.95,TRUE,,,,,Dyeables,,TRUE,United States
AVpfAqxzLJeJML430ZR5,"Elliott Lucca Black Textured Rain Boots, Women's Size 9",28.95,FALSE,Black,,New with box,,Elliott Lucca,,FALSE,
AVpfA-r3ilAPnD_xTEZ4,Yu&yu Women's Shoes Pointed Toe Chunky Heel Loafers Shoes More Colors Available,106.54,FALSE,Black,,,,,Qianyuyu,FALSE,
AVpfaR4l1cnluZ0-kSXW,"Clearly-430, 4 1/2'' Heel Closed Back Ankle Strap Sandal",44.17,FALSE,,,,,PleaserUSA,PleaserUSA,FALSE,
AVpfar-C1cnluZ0-kZeI,Toms Womens Classic Burlap Slip On Casual Shoe,54,FALSE,,Canvas,,,TOMS,Toms,TRUE,
AVpfArI-1cnluZ0-b65F,Toms Ballet Flat   Round Toe Canvas  Ballet Flats,48,FALSE,,Canvas,,,TOMS,Toms,FALSE,
AVpfARJF1cnluZ0-bxd7,Dansko Women Olivia Slippers,144.95,FALSE,Bronze Snake,,,,Dansko,Dansko LLC,FALSE,
AVpfARl6ilAPnD_xS0Yl,Aerosoles New Flaunt Black Patent Slide Wedge Sandal Sz. 9m,34.99,FALSE,Black,Synthetic,New with box,,Aerosoles,,TRUE,
AVpfarMlilAPnD_xbZ-u,Bordello Women's 'Bella-12R' Satin Peep-toe Pumps,78.95,FALSE,"Black,Blue,Ivory,Pink,Purple,Red,Silver",,,,Bordello,,TRUE,
AVpfARmrilAPnD_xS0ZM,Rampage Izo   Round Toe Synthetic  Knee High Boot,59,FALSE,,Synthetic,,Other,Rampage,Rampage,TRUE,
AVpfArQG1cnluZ0-b67Z,Women's Military Up Buckle Combat Boots Mid Knee High Exclusive Credit Card Pocket,19.99,FALSE,"Beige Pu,Black Pu,Blue Denim,Blue Pu,Brown Pu,Camouflage Cv,Hot Pink Pu,Ivory White Pu,Orange Pu,Purple Pu,Red Pu,Tan Pu,Zebra Pu",,,,DailyShoes,,FALSE,
AVpfAsEmLJeJML430ZvG,AdTec Women's Grey/Peach Work/Hiker Boots by AdTec,66.49,FALSE,Black,,,,AdTec,,TRUE,China
AVpfAsKoLJeJML430Zwz,Spring Step Women Sky Sandals,109.95,FALSE,"Black,Olive,Beige",,,,Spring Step,Spring Footwear,FALSE,
AVpfAskT1cnluZ0-b7X4,Women's Aerosoles Establish Wide Calf Black Quilted Faux Leather by Aerosoles,119.95,FALSE,"Black,Black Quilted",,,,Aerosoles,,TRUE,United States
AVpfAsL2ilAPnD_xS-AT,Prada Womens Calzture Donna Camoscio Knee Boot Size 37 Eu (7 Us) Retail $1750,419,FALSE,,,,,Prada,,FALSE,
AVpfASUjilAPnD_xS0pT,Isotoner  Women's Brushed Sweater Knit Clog Slippers,26,FALSE,"Smokey Taupe,Black,Charcoal Heather Grey",Synthetic,,Casual,Isotoner,Isotoner,FALSE,
AVpfaSulilAPnD_xbTWg,Anna Pop-5 Women  Open Toe Synthetic  Thong Sandal,39,FALSE,Beige,Synthetic,,,Anna,Anna,TRUE,
AVpfAsuZLJeJML430Z9K,Timberland Auth Teddy Fleece   Round Toe Leather  Boot,217.87,FALSE,,Leather,,,Timberland,Timberland,FALSE,
AVpfAsxFLJeJML430Z-E,New Balance Pace Women D Round Toe Synthetic Blue Running Shoe,110,FALSE,Blue,Synthetic,,,New Balance,New Balance,FALSE,
AVpfASYELJeJML430QaU,Dearfoams Valerie Women Us 5 Gray Slipper,36,FALSE,,Synthetic,,,Dearfoams,,TRUE,
AVpfaszT1cnluZ0-kZse,Vans Rainfall (checkers) Rain Boots,82.9,FALSE,CHECKERS YELLOWWHITE,,,,VANS,Vans,FALSE,
AVpfAt3bilAPnD_xS-kl,Asics Women's Gel-contend 3 Running Shoes,59.99,FALSE,,,,,ASICS,,FALSE,
AVpfAt3rilAPnD_xS-ku,Bearpaw Elizabeth   Round Toe Suede  Winter Boot,79,FALSE,Black,Suede,,,Bearpaw,Bearpaw,FALSE,
AVpfAtfq1cnluZ0-b7s1,Rupert Sanderson Res14-59 Women Patent Leather Sandals,595,FALSE,Beige,,,,Rupert Sanderson,,FALSE,
AVpfAtGlLJeJML430aFJ,Western Chief Women's Floral Fields Waterproof Clog,29.99,FALSE,Floral,,,Casual,Western Chief,,FALSE,
AVpfATi-1cnluZ0-byXL,Gotta Flurt Women's Ca-lenwood Iiii Purple/metallic Plaid Sneaker,29.99,FALSE,"PurpleMetallic,BlackMetallic",,,,Gotta Flurt,,FALSE,
AVpfATln1cnluZ0-byYH,Liz Claiborne Sophier Women  Round Toe Synthetic  Knee High Boot,90,FALSE,Black,Synthetic,,,Liz Claiborne,,TRUE,
AVpfAtv_1cnluZ0-b7yi,Reebok Women's Z Dual Rush Running Shoe,69.99,FALSE,,,,,Reebok,,FALSE,
AVpfAu0MLJeJML430aq_,Yu&yu Women's Shoes Round Toe Flat Heel Canvas Fashion Sneakers Shoes More Colors Available,92.96,FALSE,"Blue,Black,Purple",,,,,Qianyuyu,FALSE,
AVpfA-u11cnluZ0-cBq-,Bokos Women's Sandals/flip Flops - Stylish & Comfortable - Purple/lavender,20.56,FALSE,,Rubber,,,Bokos,Bokos,FALSE,
AVpfAuDU1cnluZ0-b75O,Liz Claiborne Bank Women  Open Toe Leather  Wedge Sandal,80,FALSE,,Leather,,,Liz Claiborne,Liz Claiborne,TRUE,
AVpfAUPG1cnluZ0-byme,Easy Spirit Erle Women  Round Toe Suede Gray Snow Boot,89,FALSE,,Suede,,Special Occasion,Easy Spirit,Easy Spirit,FALSE,
AVpfauZCilAPnD_xba4t,Nyvip Ny Vip Women's B7777 Tall Duck Boot Rain Snow Boot With Sherpa Lining and Quilted Canvas Upper,42.95,FALSE,"Black-Cognac,Black,Navy-Cognac,Red-Cognac",,,,NyVip,,FALSE,
AVpfaV9j1cnluZ0-kTYy,"Sneed- Customizable Women's Dance Shoes Latin/salsa Satin Customized Heel Black/blue/yellow/pink/purple/red/white/fuchsia, White-us5.5 / Eu36 / Uk3.5 / Cn35 , White-us5.5 / Eu36 / Uk3.5 / Cn35",88,FALSE,,,,,,SNEED,FALSE,
AVpfaVa-LJeJML438wvf,"Delight-1018, 6'' Heel, 1 3 4''  Ankle Boot",69.95,FALSE,,,,,PleaserUSA,PleaserUSA,FALSE,
AVpfAVBh1cnluZ0-by4q,Muk Luks Cathy Micro Chenille Closed Toe Slippers,18.99,FALSE,Ash,,,,MUK LUKS,,FALSE,
AVpfAVguilAPnD_xS104,Patrizia Women's Harlequin,43.84,FALSE,"White,Red,Turquoise,Pewter,Gold Metallic,Beige",Synthetic,,,Patrizia by Spring Step,Patrizia by Spring Step,FALSE,
AVpfAVpxilAPnD_xS14D,Easy Street Scotsdale   Round Toe Synthetic  Knee High Boot,85,FALSE,,Synthetic,,fashion,Easy Street,Easy Street,TRUE,
AVpfavZKilAPnD_xbbIN,Bella Vita Sangria Women Us 7.5 N/s White Wedge Sandal Blemish 1903,0.99,FALSE,White,Canvas,,,Bella Vita,,TRUE,
AVpfaw2EilAPnD_xbbif,Skechers Womens Og 82 Flynn Suede Low Top Fashion Sneakers,31.99,FALSE,NavyAqua,Leather & Textile Upper/Man Made Outsole,,,SKECHERS,Skechers,TRUE,
AVpfAWAXilAPnD_xS2AW,Marc Fisher Omaja   Open Toe Synthetic  Flip Flop Sandal,39,FALSE,Red,Synthetic,,,Marc Fisher,Marc Fisher,TRUE,
AVpfAwKDilAPnD_xS_W_,Skechers Women's Bobs Cherish Black Sweater Clog,94.99,FALSE,Black,,,Casual,Skechers,,FALSE,
AVpfaWL3LJeJML438w7c,Toms Women's Classic Printed Wool Light Grey Printed Wool Ankle-high Wool Flat Shoe - 7.5m,46.5,FALSE,,,,,TOMS,Toms,FALSE,
AVpfAWr6ilAPnD_xS2PP,Shoes of Soul Women's Fringe Strappy Long Sandal,23.8,FALSE,"Nude,Tan,Black",,,,SHOES OF SOUL,,FALSE,
