id,name,price,onSale,color,material,condition,occasion,brand,manufacturer,hasHeels,countryOfOrigin
AVpe8udmLJeJML43y_R6,Crystal Case Women's Sparkle Bling Studded Ballet Flats Shoe Slipper 9 Black,15.58,FALSE,,Polyurethane,,,Crystal Case,,FALSE,
AVpe8UMnLJeJML43y1g2,Diane Von Furstenberg Women's Pacey Boot,450,FALSE,Black Sport Suede,,,,Diane von Furstenberg,,FALSE,
AVpe8uunLJeJML43y_Yf,Jessica Simpson Tallinoh Women Us 6.5 Brown Oxford Pre Owned Blemish  1923,17.99,FALSE,Brown,Leather,,,Jessica Simpson,,TRUE,
AVpe8uVvLJeJML43y_PK,Wolverine Men's Opanka Stl Eh Oxf Dura Work Boot,99.9,FALSE,Dark Brown,,,,Wolverine,,FALSE,
AVpe8uzyLJeJML43y_aG,Kids' Dawgs 3-strap Sandals,14.99,FALSE,"White,Tan,Black,Navy,Lilac,Hot Pink",,,,DAWGS,"USA Dawgs, Inc.",FALSE,
AVpe8V4S1cnluZ0-aXpr,Alfani Mavida   Open Toe Synthetic  Sandals,38.99,FALSE,Silver,Synthetic,,Wear to Work,Alfani,Alfani,TRUE,
AVpe8Vcf1cnluZ0-aXfe,G Antini Ladies Translucent Slim High Heel Pointed Toe Pumps (size 7.5),60.99,FALSE,Black,100% Faux Leather,,,Unique Bargains,,FALSE,
AVpe8VnS1cnluZ0-aXjk,Nine West Diablo Women  Pointed Toe Leather Brown Knee High Boot,179,FALSE,"Dark Brown,Black,Brown",Leather,,,Nine West,Nine West,TRUE,
AVpe8wfv1cnluZ0-ahgN,Bcbgeneration Kadeer   Round Toe Suede  Ankle Boot,150,FALSE,,Suede,,,BCBGeneration,BCBGeneration,TRUE,
AVpe8WjTilAPnD_xRats,Asics Women's Gel-fujitrabuco 3 Neutral Running Shoe,120,FALSE,TitaniumBlackMagenta,,,,ASICS,,FALSE,
AVpe8wLOilAPnD_xRkO-,Nike Women's Dual Fusion Tr 3 Print Training Shoe,80,FALSE,,Mesh,,Training Shoes,Nike,Nike,FALSE,
AVpe8wPs1cnluZ0-ahaO,Donald J Pliner Calla2-dd Women  Square Toe Canvas Brown Bootie,198,FALSE,,Canvas,,,Donald J Pliner,Donald J Pliner,TRUE,
AVpe8WTuLJeJML43y2PF,"Sneed- Customizable Women's Dance Shoes Latin/salsa Satin Customized Heel Black/blue/yellow/pink/purple/red/white/fuchsia, Red-us6 / Eu36 / Uk4 / Cn36 , Red-us6 / Eu36 / Uk4 / Cn36",88,FALSE,,,,,,SNEED,FALSE,
AVpe--8X1cnluZ0-bU1d,Klogs Sydney Women's Leather Supportive Clog - Slate,119.95,FALSE,"Black,Driftwood,Gray,Marsala",,,,Klogs,Latitudes Inc.,FALSE,
AVpe8x7XLJeJML43zAip,Style & Co Nash   Round Toe Canvas  Mid Calf Boot,79,FALSE,,Canvas,,,Style & Co.,Style & Co,TRUE,
AVpe8XbX1cnluZ0-aYNm,"Revolver-701, Rhinestone Embellished Gun Heel Sandals",55.55,FALSE,,,,,PleaserUSA,PleaserUSA,FALSE,
AVpe8xYnilAPnD_xRktO,Sunny Feet Norris-16 Women  Open Toe Synthetic  Thong Sandal,13,FALSE,Pink,Synthetic,,,Sunny Feet,Sunny Feet,TRUE,
AVpe8y3BilAPnD_xRlRL,Moda Essentials Women's Fringe Cowboy Western Booties Boots,80,FALSE,Brown,,,,Moda Essentials,,TRUE,
AVpe8Y-9LJeJML43y3LO,Hadari Women's Knee High Boot,40.99,FALSE,Brown,,,,Hadari,,FALSE,
AVpe8yadilAPnD_xRlGd,Bcbgeneration Women's Treasure Canvas Watercolor Ankle-high Canvas Pump - 6.5m,50,FALSE,,,,,BCBGeneration,Bcbgeneration,FALSE,
AVpe8-YELJeJML43zFGn,Naturalizer Applause Women Us 9.5 Nude Flats W/out Box 1690,8.99,FALSE,Beige,Patent Leather,,,Naturalizer,,TRUE,
AVpe8Ytj1cnluZ0-aYpr,Nine West Qualify   Open Toe Suede  Sandals,89,FALSE,Multicolor,Suede,,,Nine West,Nine West,FALSE,
AVpe8YxyLJeJML43y3Fq,Ladies Pink Soft Canvas Stretchy Bands Flat Ballet Dancing Shoes Uk Size 2.5,18.99,FALSE,Pink,Faux Leather||Canvas,New,,Unique Bargains,,FALSE,
AVpe8ZAO1cnluZ0-aYxT,Pink Leather Spandex Split Sole Elastic Strap Ballet Shoes 5-12 Womens,40,FALSE,,,,,Dance Class,Dance Class,FALSE,
AVpe8ZjYLJeJML43y3Z7,Lauren Ralph Lauren Abegayle Women  Open Toe Leather  Thong Sandal,69,FALSE,,Leather,,,Lauren Ralph Lauren,Lauren Ralph Lauren,FALSE,
AVpe8ZPyLJeJML43y3SN,Adidas Women's Climacool II Clear Aqua/ White/ Silver Golf Shoes by Adidas,65.27,FALSE,"Green,Silver,White",,,,Adidas,,FALSE,China
AVpe8zrAilAPnD_xRlle,New Balance Wl118 Women  Round Toe Synthetic Black Ballet Flats,65,FALSE,,Synthetic,,,New Balance,New Balance,FALSE,
AVpe8zVPLJeJML43zBEt,"*new* Callaway Xfer Sport Men's Golf Shoes M339 - Us 9, Uk 8, Eu 42 Medium",89.9,FALSE,WhiteBlack,Microfibre,,,Callaway,,FALSE,
AVpe8zYh1cnluZ0-ainU,"Sneed- Customizable Women's Dance Shoes Latin/salsa Satin Customized Heel Black/blue/yellow/pink/purple/red/white/fuchsia, Yellow-us7.5 / Eu38 / Uk5.5 / Cn38 , Yellow-us7.5 / Eu38 / Uk5.5 / Cn38",88,FALSE,,,,,,SNEED,FALSE,
AVpe9_q8ilAPnD_xSBDz,"Sneed- Customizable Women's Dance Shoes Latin/salsa Satin Customized Heel Black/blue/yellow/pink/purple/red/white/fuchsia, Nude-us6.5-7 / Eu37 / Uk4.5-5 / Cn37 , Nude-us6.5-7 / Eu37 / Uk4.5-5 / Cn37",88,FALSE,,,,,,SNEED,FALSE,
AVpe90_01cnluZ0-a6c6,Im Link Girls Floral Dress Slipper Shoes,42.95,FALSE,"Ivory,Light Pink",Synthetic,,,IM Link,IM Link,FALSE,
AVpe908T1cnluZ0-a6bZ,'audra' Sandal (women),46.87,FALSE,,,,,UGG,,FALSE,
AVpe90mW1cnluZ0-a6UA,Mix No 6 Chelle   Peep-toe Synthetic  Heels,5.99,FALSE,Beige,Synthetic,,,Mix No 6,Mix No 6,TRUE,
AVpe90TKilAPnD_xR8-z,A2 By Aerosoles Lollipowp Women Us 8.5 Black Sandals Pre Owned 1690,11.99,FALSE,Black,Synthetic,,,A2 By Aerosoles,,TRUE,
AVpe91jqilAPnD_xR9Z7,Naya Kiss Women Us 10 White Open Toe Slingback Sandal,129,FALSE,,Leather,,,NAYA,,TRUE,
AVpe92_5LJeJML43zZpn,New Balance W450 Women  Round Toe Synthetic Gray Running Shoe,70,FALSE,,Synthetic,,,New Balance,New Balance,FALSE,
AVpe92BLilAPnD_xR9lP,Yu&yu Women's Shoes Babihaus Round Toe Wedge Heel Patent Leather Fashion Sneakers Shoes,266.4,FALSE,Silver,,,,,Qianyuyu,FALSE,
AVpe92ImilAPnD_xR9n2,Guess Jin Women  Round Toe Leather  Knee High Boot,225,FALSE,,Leather,,fashion,GUESS,Guess,TRUE,
AVpe9320LJeJML43zZ-C,"Dearfoams Size Medium Womens Terry Fluffy Clog Slipper, Pink",24,FALSE,,,,,Dearfoams,Dearfoams,FALSE,
AVpe93DHLJeJML43zZqt,Blue Espadrille Folding Shoes by FIC,27.99,FALSE,Blue,,,,FIC,,FALSE,China
AVpe93FSilAPnD_xR9-A,"Delight-601-4, Glitter Filled Platform Slide Shoe",27.35,FALSE,,,,,PleaserUSA,PleaserUSA,FALSE,
AVpe93o11cnluZ0-a7bM,Beston Women's GF58 Drawstring Inside Zip Block Heel Snug Fit Thigh High Boots,35.19,FALSE,"Black,Blue,Brown,Grey,Red",,,,Beston,,TRUE,
AVpe93pD1cnluZ0-a7bQ,New Balance Wl410   Round Toe Synthetic  Sneakers,65,FALSE,BlackBright Cherry SuedeTextile,Synthetic,,,New Balance,New Balance,FALSE,
AVpe946-ilAPnD_xR-pP,Toms Womens Classic Mesh Slip On Casual Shoe,41,FALSE,"Black,Silver,Multi-Colored","Mesh,Canvas,Fabric",,"Lifestyle,Casual Shoes",TOMS,Toms,TRUE,
AVpe94gkilAPnD_xR-fr,Caparros Parisian Women  Pointed Toe Synthetic Gold Heels,89,FALSE,Gold,Synthetic,,Formal,Caparros,Caparros,TRUE,
AVpe94Q-ilAPnD_xR-Z0,Devious Dagger-3000 Women Us 6 Black Over The Knee Boot,29.99,FALSE,Black,Synthetic,New with box,,Devious,,TRUE,
AVpe95M_LJeJML43zadt,Blowfish Women's Frin Whiskey Ospu Ankle-high Leather Boot - 6m,39,FALSE,,,,Fashion,Blowfish,Blowfish,FALSE,
AVpe95PailAPnD_xR-xU,Pearl Faux Suede Stiletto High Heel Electric Blue Court Shoes Size 6,69.98,FALSE,,Synthetic,,,,ShuWish UK,FALSE,
AVpe96_BLJeJML43zbGs,Journee Collection Women's 'Emm' Open Toe Faux Suede Booties by Journee Collection,42.49,FALSE,"Black,Brown,Grey",,,,Journee Collection,,FALSE,China
AVpe96HeLJeJML43zayZ,'dasan' Platform Wedge Bootie (women),99.5,FALSE,,,,,Vince Camuto,,FALSE,
AVpe96hi1cnluZ0-a8eb,Klogs Women Mission Clogs,59.95,FALSE,"Mahogany Smooth,Tigerberry",,,,Klogs,Latitudes Inc.,FALSE,
AVpe96nNilAPnD_xR_Qw,Clarks® Leisa Cacti Womens Open-toe Leather Sandals Size 6.5w (brand New In Box),37,FALSE,Brown,,New with box,,Clarks,,FALSE,
AVpe97MPLJeJML43zbLn,"Sneed- Customizable Women's Dance Shoes Latin/salsa Satin Customized Heel Black/blue/yellow/pink/purple/red/white/fuchsia, Fuchsia-us6 / Eu36 / Uk4 / Cn36 , Fuchsia-us6 / Eu36 / Uk4 / Cn36",86,FALSE,,,,,,SNEED,FALSE,
AVpe97TvilAPnD_xR_gr,Womens Easy Spirit Briano Mid-calf Comfort Boots - Black,56.99,FALSE,"Black,DBRNDBR",Leather,,,Easy Spirit,Easy Spirit,TRUE,
AVpe97w1ilAPnD_xR_qk,Matt Bernson The Love Sandal   Open Toe Leather  Flip Flop Sandal,129,FALSE,Blue,Leather,,,Matt Bernson,Matt Bernson,TRUE,
AVpe98X-LJeJML43zbkp,Bongo Women's Moxie Moccasin Slipper - Pink,29.99,FALSE,Pink,,,Casual,Bongo,,FALSE,
AVpe99cqilAPnD_xSAP6,Leisureland Women's Solid Bootie Slippers by Leisureland,12.99,FALSE,"Black,Brown,Orange,Pink,Purple,Red",,,,Leisureland,,FALSE,China
AVpe99IlLJeJML43zb3i,Style & Co. Women's Vern T-strap Wedge Slides,22.19,FALSE,Phonebox Red,,,Casual,Style & Co.,Style & Co.,TRUE,
AVpe99jn1cnluZ0-a9jr,Isaac Mizrahi Printed Short Velveteen Jacket Nwot $85 L New 100% Perfect Conditi,134.99,TRUE,"Royal Plum,Red Fabric",Read Listing,,,Issac Mizrahi,,FALSE,
AVpe9a3zLJeJML43zPh8,Bordello Siren 05g   Open-toe Synthetic  Slingback Heel,60,FALSE,,Synthetic,,,Bordello,Bordello,TRUE,
AVpe9AAe1cnluZ0-anNf,Penny Loves Kenny Shiver Women  Pointed Toe Canvas Black Heels,70,FALSE,,Canvas,,,Penny Loves Kenny,Penny Loves Kenny,TRUE,
AVpe9AdTilAPnD_xRqPb,Slippers Pillowpaw Lmn Small 96pr/cs,97.2,FALSE,,,,,Pillow Paws,PRINCIPLE,FALSE,
AVpe9AeC1cnluZ0-anYf,Beacon Kinsey Women N/s Round Toe Synthetic  Flats,55,FALSE,,Synthetic,,,Beacon,Beacon,TRUE,
AVpe9agzilAPnD_xRzu-,Schutz Women's Juliana Suede Sailfish Ankle-high Suede Pump - 6m,112.76,FALSE,,,,,Schutz,Schutz,FALSE,
AVpe9ahRLJeJML43zPY_,G By Guess Netty   Round Toe Synthetic  Mid Calf Boot,59,FALSE,Black,Synthetic,,,G BY GUESS,G By Guess,FALSE,
AVpe9aTtLJeJML43zPTx,Allegra K Women's Square Peep Toe Slip On Chunky High Heel Mules Brown (size 10.5),67.99,FALSE,,PU,,,G ANTINI,,FALSE,
AVpe9bHKilAPnD_xRz8L,Skechers For Work Women's D-lite Slip Resistant Shoes Wide Width Size 10,49.99,FALSE,,,,,SKECHERS,,FALSE,
AVpe9brVLJeJML43zP0t,Alpineswiss Womens Rhinestone Sandals Padded Sole Thongs Comfort Flat Flip Flops,26.5,FALSE,"Gold,Silver",Man-Made Materials,,,Alpine Swiss,,FALSE,
AVpe9bsALJeJML43zP1I,Allegra K Women's Open Toe Chunky Mid Heel Ankle Strap Sandals Black (size 9),56.99,FALSE,,PU,,,G ANTINI,,FALSE,
AVpe9BZ-1cnluZ0-anvO,Faded Glory Women's Fashion Cowboy Boot Online Only,29.87,FALSE,"Light Brown,Black,GrayBlack,Gray,Brown",,,,Faded Glory,,FALSE,
AVpe9CAqLJeJML43zGde,Muk Luks174 Women's Pewter Morgan Wedge Sandals,54.95,FALSE,"Bronze,Pewter",,,Casual,MUK LUKS174,,TRUE,
AVpe9ckC1cnluZ0-axq_,Easycomforts   Diabetic Slipper Socks With Gripper Soles,13.19,FALSE,"White,Tan,Black",Nylon,,,EasyComforts,,FALSE,
AVpe9CNu1cnluZ0-aoDs,Oofos Unisex Ooahh Slide Sandal,39.95,FALSE,"Navy,Black,Steel",,,,Oofos,OOFOS,FALSE,
AVpe9COWilAPnD_xRq60,Coach Womens Harlee Split Toe Formal Slide Sandals,63.39,FALSE,,,,Wear to Work,Coach,Coach,TRUE,
AVpe9d6BLJeJML43zQnh,Ahnu Northridge Women  Round Toe Canvas Burgundy Snow Boot,180,FALSE,,Canvas,,,Ahnu,Ahnu,TRUE,
AVpe9DOOLJeJML43zG5k,Tahari Camilla Women  Round Toe Suede Black Bootie,119,FALSE,Black,Suede,,,Elie Tahari,Tahari,FALSE,
AVpe9DT-ilAPnD_xRrU0,Xoxo Women's Sunday Perforated Wedge Sandal,59,FALSE,"Black,Tan",Synthetic,,,XOXO,XOXO,TRUE,
AVpe9dVILJeJML43zQbV,Ellie Women's '400-Ahoy' Black Patent Skull Print Pumps,57.99,FALSE,Black,,,,Ellie,,TRUE,China
AVpe9dW01cnluZ0-ax9N,Pas De Rouge Nicla Women Leather Ankle Boot,498,FALSE,Red,,,,Pas De Rouge,,FALSE,
AVpe9e4OLJeJML43zQ9C,Women's Devious Tramp 726 Platform Sandal Black Patent/Black,64.95,FALSE,,,,,Devious,,TRUE,United States
AVpe9epX1cnluZ0-ayZp,Ahnu Serena Women Us 9.5 Tan Thong Sandal Pre Owned 1903,18.99,FALSE,Beige,Synthetic,,,Ahnu,,TRUE,
AVpe9EV0ilAPnD_xRrr5,Marc Fisher Genny Women  Open Toe Leather  Wedge Sandal,69,FALSE,Black,Leather,,,Marc Fisher,Marc Fisher,TRUE,
AVpe9Ewr1cnluZ0-apAH,Retro Peep Toe Sandal (women),1100,FALSE,,,,,Prada,,FALSE,
AVpe9FK61cnluZ0-apJ1,Easy Street Trifecta Women N/s Open-toe Synthetic Silver Slingback Sandal,50,FALSE,"Black Patent,Silver",Synthetic,,,Easy Street,Easy Street,TRUE,
AVpe9fND1cnluZ0-aymI,Bow Over The Knee Boot,1695,FALSE,,,,,Valentino,,FALSE,
AVpe9FRCilAPnD_xRsCV,"105-saddle, 1'' Heel Women Saddle Shoe",49.99,FALSE,Pink and White,Polyurethane,,,ELLIE SHOES,Ellie Shoes Inc,FALSE,
AVpe9fxailAPnD_xR1mf,Women's Ivory Short Suede Boot - Black,24.99,FALSE,,,,Casual,Route 66,,FALSE,
AVpe9G1PLJeJML43zIMY,Indigo Rd. Slaire Women  Round Toe Synthetic Black Bootie,69,FALSE,,Synthetic,,,Indigo Rd.,Indigo Rd.,FALSE,
AVpe9GcCLJeJML43zIEV,Journee Collection Women's 'Carol' Almond Toe Slingback Pumps by Journee Collection,35.19,FALSE,"Black,Brown,Grey,Red,Tan",,,,Journee Collection,,TRUE,China
AVpe9gj41cnluZ0-azFl,Victory Winter Boots,80,FALSE,,,,,Puma,,FALSE,
AVpe9gZuLJeJML43zRfR,'triumph' Thong Sandal (women),59.9,FALSE,,,,,BCBGeneration,,FALSE,
AVpe9h9gLJeJML43zSDq,Muk Luks174 Women's Bronze Tina Sandals,41.95,FALSE,"Multi,Black,Bronze",,,Casual,MUK LUKS174,,TRUE,
AVpe9Ha0ilAPnD_xRsws,"Hot-selling Brand New Latin Dance Shoes High Heel For Ladies/girls/women/ballroom Tango Shoes 7cm-black & Red,black & Gold,3.5",19.52,FALSE,,,,,,Generic,FALSE,
AVpe9HpCLJeJML43zIe7,'adi-ease' Sneaker (women),69.95,FALSE,,,,,adidas,,FALSE,
AVpe9i8E1cnluZ0-az9D,* New * Asics Gel Pivot 10 Womens Netball Shoe (b) (5001),114.9,FALSE,"B,US",,New with box,,ASICS,,FALSE,
AVpe9IBk1cnluZ0-aqJF,"Sneed- Customized Latin Women's Sandals Customized Heel Dance Shoes With Rhinestone Buckle More Colors, Gold-us8.5 / Eu39 / Uk6.5 / Cn40 , Gold-us8.5 / Eu39 / Uk6.5 / Cn40",101,FALSE,,,,,,SNEED,FALSE,
AVpe9iii1cnluZ0-azzb,Brinley Co. Women's Round Toe Faux Suede Tall Wide Calf Boots,54.99,FALSE,"Black,Taupe",Faux Suede,,,Brinley Co.,Brinley Co.,FALSE,
AVpe9IPY1cnluZ0-aqOH,Pelle Moda Wentz Women  Peep-toe Suede Nude Bootie,190,FALSE,Beige,Suede,,,Pelle Moda,Pelle Moda,TRUE,
AVpe9IVaLJeJML43zIvm,Chinese Laundry Womens 'bright Lites' Platform Pump,119.95,FALSE,"Blue  Multi,Brown  Multi",Fabric,,,Chinese Laundry,Chinese Laundry,TRUE,
AVpe9ji4LJeJML43zSnC,"Lucy-01, 3 1/4'' Heel Slide Sandal",27.92,FALSE,,,,,PleaserUSA,PleaserUSA,FALSE,
AVpe9jkv1cnluZ0-a0LC,Khombu Quechee Stingray   Round Toe Leather  Snow Boot,119,FALSE,Black,Leather,,fashion,Khombu,Khombu,TRUE,
AVpe9jn21cnluZ0-a0MR,New Jessica Simpson Brouge Open Toe Platform Sandal Pump Womens Size 6,89,FALSE,"Green,Pastel Green",Leather,New with box,,Jessica Simpson,,TRUE,
AVpe9juKLJeJML43zSrQ,Skechers Go Walk 4 Pursuit Women  Round Toe Canvas  Walking Shoe,44.76,FALSE,,Canvas,,,SKECHERS,Skechers,FALSE,
AVpe9jZ61cnluZ0-a0Gr,Asics Womens T485n Gel-nimbus 16 Running Shoe Pink Green Black Size 8.5 B,110.69,FALSE,,,New with tags,,ASICS,,FALSE,
AVpe9K171cnluZ0-arJ9,Hailey Jeans Co. Women's 'Zafrina' Lace-Up Buckle-Strap Combat Boots by Hailey Jeans Co.,84.99,TRUE,"Beige,Black,Blue,Beige Black Blue",,,,Hailey Jeans Co.,,TRUE,China
AVpe9Kb51cnluZ0-arAS,Dkny Ivana Women  Round Toe Suede Green Espadrille,115,FALSE,,Suede,,,DKNY,Dkny,FALSE,
AVpe9kqOLJeJML43zTAS,Vince Camuto Paulete Women  Peep-toe Synthetic  Heels,175,FALSE,Silver,Synthetic,,,Vince Camuto,Vince Camuto,TRUE,
AVpe9lmHilAPnD_xR3ny,Brinley Co. Women's Over-the-knee High Heel Faux Suede Wide Calf Boots,54.99,FALSE,"Black,Taupe",Faux Suede,,,Brinley Co.,Brinley Co.,TRUE,
AVpe9LmN1cnluZ0-arbN,Asics Women's Gel-contend Running Shoes,59.99,FALSE,,,,,ASICS,,FALSE,
AVpe9LZa1cnluZ0-arWL,"Silverts 103500413 Womens Foamtread Slipper Cloth Tie Brand - Black, Size 11",50.19,FALSE,,,,,Silvert's,,FALSE,
AVpe9MagLJeJML43zKMW,Womens Toms Classic Slip-on Flats - Silver Crochet Glitter,54,FALSE,"Black Glitter,Gold Navy,Silver",Fabric,,,TOMS,TOMS,TRUE,
AVpe9MAX1cnluZ0-arkR,A.x.n.y. Alpha Women  Round Toe Synthetic Brown Ankle Boot,55,FALSE,,Synthetic,,,a.x.n.y.,a.x.n.y.,TRUE,
AVpe9MGgilAPnD_xRudu,Carole Hochman Womens Satin Casual Slide Slippers,22.99,FALSE,"Sweet Truffle,Violet",97% Polyester/3% Spandex,,,Carole Hochman,Carole Hochman,TRUE,
AVpe9miw1cnluZ0-a1Ml,New Balance 554 Womens Shoes 8 1/2 B Dark Brown - W554bbv New In Box Nib,29.99,FALSE,Brown,Suede,New with box,,New Balance,,FALSE,
AVpe9m-oLJeJML43zTzb,43% Off! Wholesale Lot 36 Pairs Women Ladies Metallic T-strap Jelly Sandals 5-11,264.99,FALSE,,,New,,DD,,FALSE,
AVpe9NeLilAPnD_xRu8i,Baretraps Rexie Women  Round Toe Leather Yellow Fisherman Sandal,59,FALSE,Yellow,Leather,,,BareTraps,Baretraps,FALSE,
AVpe9NwW1cnluZ0-asMX,Nike Women's In-season Tr 5 Training Shoe,75,FALSE,"BlackWhiteDark GreyAnthrct,Black",Mesh,,Casual Shoes,Nike,Nike,FALSE,
AVpe9o7oilAPnD_xR41q,Maker's Shoes Women's Kendall Black Fuchsia 3 Running Lace Up Sneakers 9 M Us,39.99,FALSE,Black Fuchsia,,,,Maker's Shoes,,FALSE,
AVpe9ObZ1cnluZ0-asa9,Yu&yu Women's Shoes Low Heel Round Toe Fashion Sneakers Casual Shoes More Colors Available,106.54,FALSE,"Red,Black",,,,,Qianyuyu,FALSE,
AVpe9oi4ilAPnD_xR4sr,"Gameday Womens 13 Brass Leather Boise State Cowboy Boots (size 6.5) Bsu-l024-1""",119,FALSE,Brown,Leather,,,Gameday Boots,GameDay Boots,FALSE,
AVpe9oN8LJeJML43zUPv,Kelly & Katie Petra Women  Open Toe Canvas Black Sandals,65,FALSE,,Canvas,,,Kelly & Katie,Kelly & Katie,TRUE,
AVpe9p131cnluZ0-a2aO,Kenneth Cole Reaction Sole Search   Open Toe Leather  Wedge Heel,89,FALSE,Gray,Leather,,,Kenneth Cole Reaction,Kenneth Cole Reaction,TRUE,
AVpe9p7jLJeJML43zU4G,Toms Women's Platform Wedge Casual Shoe,44.93,FALSE,,Cork,,,TOMS,,FALSE,
AVpe9PAGilAPnD_xRvcm,Skechers Women's Bobs Bliss - Open Heart Shoe,49.99,FALSE,,,,,Skechers,,FALSE,
AVpe9pAO1cnluZ0-a2Ho,"Sneed- Non Customizable Women's Dance Shoes Latin Suede Cuban Heel Outdoor More Colors, Blue-us7.5 / Eu38 / Uk5.5 / Cn38 , Blue-us7.5 / Eu38 / Uk5.5 / Cn38",72,FALSE,,,,,,SNEED,FALSE,
AVpe9PGC1cnluZ0-aspj,"Women's Not Rated, Santo Sandal",49,FALSE,Tan,Leather,,,NAUGHTY MONKEY,NAUGHTY MONKEY,TRUE,
AVpe9PJ81cnluZ0-asrG,"Gogo-300, 3'' Block Heel Stretch Boot",46.43,FALSE,"Orange Stretch Patent,Lime Stretch Patent,Gold Stretch Pu,Yellow Stretch Patent,Neon Blue,Purple Stretch Pat,White Stretch Patent,Red Stretch Patent,Black Stretch PU,Silver Stretch Pu,White Stretch Pu,Red-Patent",,,,PleaserUSA,PleaserUSA,FALSE,
AVpe9pRILJeJML43zUoi,Reebok Hexaffect Run 2.0 Mt   Round Toe Synthetic  Running Shoe,80,FALSE,,Synthetic,,,Reebok,Reebok,FALSE,
AVpe9Q8iilAPnD_xRwLk,Yu&yu Women's Shoes Round Toe Flat Heel Calf Hair Loafers Shoes More Colors Available,98.13,FALSE,"Black,Khaki,Orange",,,,,Qianyuyu,FALSE,
AVpe9q8OilAPnD_xR5kk,Chinese Laundry Galactic Women Us 7.5 Black Gladiator Sandal Pre Owned 1650,19.99,FALSE,Black,Synthetic,,,Chinese Laundry,,TRUE,
AVpe9q9FLJeJML43zVQ3,Penny Loves Kenny Tristen  Women  Open Toe Synthetic  Gladiator Sandal,69,FALSE,Gray,Synthetic,,,Penny Loves Kenny,Penny Loves Kenny,TRUE,
AVpe9qDnLJeJML43zU7J,Nike Women's Lunar Summer Lite 2 Golf Shoes,79.99,FALSE,,,,,Nike,,FALSE,
AVpe9qEYilAPnD_xR5Py,Karen Scott Carolton Women Us 10 Gray Slingback Sandal Pre Owned 1932,5.99,FALSE,Gray,Canvas,,,Karen Scott,,TRUE,
AVpe9QfJ1cnluZ0-atKX,Franco Sarto Nolan971 Women Us 7 Black Loafer Uk 5 Eu 37.5 Pre Owned 1690,3.99,FALSE,Black,Leather,,,Franco Sarto,,TRUE,
AVpe9Qmk1cnluZ0-atM-,6514 Lightly Worn Women's Shoes Franco Sarto Black Suede Zipper Boots 7 M,22.17,FALSE,Black,Suede,,,Franco Sarto,,TRUE,
AVpe9qnJ1cnluZ0-a2s8,Aerosoles Women's Atomic Sandal,29.04,FALSE,"Black,Black Snake,Bone Snake",Synthetic,,,Aerosoles,Aerosoles,FALSE,
AVpe9QTK1cnluZ0-atFt,Grasshoppers Janey   Round Toe Canvas  Sneakers,60,FALSE,"Stone,Beige",Canvas,,,Grasshoppers,Grasshoppers,FALSE,
AVpe9QVd1cnluZ0-atGq,Mizuno 9-spike Advanced Sweep 2 Fastpitch Cleat - White/navy - Metal - Size 11.5,69.95,FALSE,,,New,,Mizuno,Mizuno,FALSE,
AVpe9R4x1cnluZ0-atql,Michael Kors Black Mk Monogram Charm Jelly Cork Sandals Women's Size 10 New,54.95,FALSE,"Black,Gold",,New without box,,Michael Kors,,TRUE,
AVpe9RBlilAPnD_xRwM9,Rocket Dog Redell Women  Round Toe Canvas Black Sneakers,70,FALSE,,Canvas,,,Rocket Dog,Rocket Dog,FALSE,
AVpe9RfoLJeJML43zMBa,Columbia Minx Mid Ii Omni-heat Women  Round Toe Synthetic White Winter Boot,120,FALSE,White,Synthetic,,,Columbia,Columbia,FALSE,
AVpe9roPLJeJML43zVf4,MOHR Women's Dark Yellow Pleated Neckline Sleeveless Dress (India) by In-Sattva,59.99,FALSE,Yellow,,,,In-Sattva,,FALSE,India
AVpe9RT-1cnluZ0-atdV,Toms Womens Avalon Slip-ons Blue Batik Tropical Palms,39.55,FALSE,,Leather,,,TOMS,Toms,FALSE,
AVpe9s3bilAPnD_xR6Ps,Slip-on Sneaker (women),290,FALSE,,,,,Junya Watanabe,,FALSE,
AVpe9sKAilAPnD_xR6A5,Bamboo Crossing-04 Women Us 7.5 Orange Gladiator Sandal,25,FALSE,,Synthetic,,,Bamboo,,TRUE,
AVpe9sPV1cnluZ0-a3Q0,Eric Michael Tally Lexi Women  Open Toe Leather  Wedge Sandal,120,FALSE,Brown,Leather,,,Eric Michael,Eric Michael,TRUE,
AVpe9T4tilAPnD_xRxS_,Toms Women's Nepal Boot,98,FALSE,Rawhide,Suede,,Boots,TOMS,TOMS,FALSE,
AVpe9tfhilAPnD_xR6d8,Refresh MARA-01 Women's Slide-on Criss Cross Platform Wedge Sandals,35.49,FALSE,"Black,Brown,Pink,White,Beige",,,,Refresh,,TRUE,China
AVpe9tFqLJeJML43zV_4,Italian Comfort 1417f3 Women Us 9 Brown Clogs,55,FALSE,,,,,ITALIAN COMFORT,,FALSE,
AVpe9U0YLJeJML43zNTP,Womens Halloween Black Short Victorian Steampunk Boots Size 6,47.36,FALSE,,Polyurethane,,Halloween,Pleaser Shoes,Pleaser Shoes,FALSE,
AVpe9U1gilAPnD_xRxqo,"Size 8 Work Boots, Women's, Black, Steel Toe, E, Mellow Walk",118.76,FALSE,BlackBlack,,,,MELLOW WALK,MELLOW WALK,FALSE,
AVpe9UMq1cnluZ0-auj0,Giani Bernini Dannie Leather Ankle Boots,109,FALSE,Oxblood,Leather,,,Giani Bernini,Giani Bernini,TRUE,
AVpe9UNl1cnluZ0-aukb,Toms Desert Wedge   Open Toe Canvas  Wedge Heel,89,FALSE,Black,Canvas,,,TOMS,Toms,FALSE,
AVpe9utM1cnluZ0-a4Jc,Modern Rush Janette Women  Open Toe Synthetic  Sandals,45,FALSE,Silver,Synthetic,,,Modern Rush,Modern Rush,TRUE,
AVpe9U-zilAPnD_xRxuF,Enzo Angiolini Womens Demario Platform Pump Shoe,89.99,FALSE,"Natural,Red Patent",Leather,,,Enzo Angiolini,Enzo Angiolini,TRUE,
AVpe9VEJLJeJML43zNZo,2 Lips Too Too Skip Synthetic Ballet Flats,60,FALSE,Beige,,,,2 Lips Too,,FALSE,
AVpe9VFzilAPnD_xRxw2,Lauren Ralph Lauren Sarina   Pointed Toe Leather  Heels,19.99,FALSE,Red,Leather,,,Lauren Ralph Lauren,Lauren Ralph Lauren,TRUE,
AVpe9vgG1cnluZ0-a4ct,Womens Bar Iii Sahara Platform Wedge Lace-up Sandals - Blue Wing Teal,43.89,FALSE,"Blue,Dark Tan,Brown,Blue Wing Teal",Synthetic,,Casual,bar III,bar III,TRUE,
AVpe9VNDLJeJML43zNdD,Frye Carson Riding Boot   Round Toe Leather  Knee High Boot,398,FALSE,,Leather,,fashion,Frye,Frye,TRUE,
AVpe9vtLilAPnD_xR7S9,Coconuts By Matisse Women's El Camino Brown Ankle Cowboy Boot,101.99,FALSE,Brown,,,Casual,Coconuts by Matisse,,TRUE,
AVpe9VvuLJeJML43zNn3,Yu&yu Women's Shoes Liangmeiyue Comfort Flat Heel Flats Shoes With Rhinestone Casual Shoes More Colors Available,57.77,FALSE,"Blue,White,Black,Pink",,,,,Qianyuyu,FALSE,
AVpe9VWRLJeJML43zNgJ,Womens Velvet Ballet Flats Slip On Shoes Rhinestones & Cut Out Design 6 Colors,29.5,FALSE,"Black,Brown,Coral,Gray,Turqoise",Faux Leather,,,Luo Luo,,FALSE,
AVpe9VX5ilAPnD_xRx3K,Muk Luks Women's Brown Malena Boot by Muk Luks,51.99,FALSE,Brown,,,,Muk Luks,,TRUE,China
AVpe9W_I1cnluZ0-avid,Michael Kors Women's Rory Black Suede Boot,126.99,FALSE,Blakc,,,,Michael Kors,Michael Kors,FALSE,
AVpe9wv7ilAPnD_xR7sG,Bcbg Max Azria Clip Women  Round Toe Leather  Sneakers,195,FALSE,,Leather,,,BCBG Max Azria,BCBG Max Azria,FALSE,
AVpe9wvqilAPnD_xR7r8,Rock & Candy Martha Women Round Toe Canvas Ankle Boot,33.79,FALSE,,,,,ROCK & CANDY,ROCK & CANDY,FALSE,
AVpe9WZk1cnluZ0-avUm,Under Armour Women's Ua Speedform Fortis 2 Running Shoes,99.99,FALSE,,,,,Under Armour,,FALSE,
AVpe9X1vLJeJML43zOXV,Belle Sigerson Morrison Maia Women  Round Toe Suede Gray Ballet Flats,240,FALSE,Gray,Suede,,,Belle Sigerson Morrison,Belle Sigerson Morrison,TRUE,
AVpe9x2s1cnluZ0-a5VO,Xoxo Sadelia Women Us 11 White Thong Sandal Uk 8.5 Eu 43,20,FALSE,,Synthetic,,,XOXO,,TRUE,
AVpe9x3l1cnluZ0-a5Vv,Bamboo RATTLE-17 Women's Lace Up Back Sweater Puff Chunky Heel Ankle Booties by Bamboo,43.99,FALSE,Black,,,,Bamboo,,FALSE,China
AVpe9x6j1cnluZ0-a5XU,Nine West Taboulie   Open Toe Leather  Wedge Heel,95,FALSE,Green,Leather,,,Nine West,Nine West,FALSE,
AVpe-9xcLJeJML43zy1V,Nine West Diablo Wide Calf Women  Round Toe Leather  Knee High Boot,179,FALSE,Black,Leather,,Casual,Nine West,Nine West,TRUE,
AVpe9XOOilAPnD_xRyev,Converse Chuck Taylor Hi Women's Shoes Size,49.9,TRUE,Black,,,,Converse,,FALSE,
AVpe9xwO1cnluZ0-a5S3,Vibrant 5 Inch Neon Yellow Heels and Black Patent Top Strap Sassy Slide Sandals,60.99,FALSE,Yellow,Synthetic,,,SummitFashions,,TRUE,
AVpe9Xxs1cnluZ0-av1Q,Michael Michael Kors Blythe   Open Toe Leather  Sandals,185,FALSE,Silver,Leather,,,MICHAEL Michael Kors,MICHAEL Michael Kors,TRUE,
AVpe9Y3O1cnluZ0-awPV,Isotoner Women's Iso Satin Bow Ballet Slippers,13.59,FALSE,,,,,Isotoner,,FALSE,
AVpe9y7eilAPnD_xR8fe,Asics Women's Gel-sendai 2 Running Shoes,119.98,FALSE,,,,,ASICS,,FALSE,
AVpe9YhFilAPnD_xRy-E,Nike Women's Air Max Thea Print Running Shoe,154.34,FALSE,,Mesh,,Casual Shoes,Nike,Nike,FALSE,
AVpe9ypyLJeJML43zYFC,Vans Authentic   Round Toe Canvas  Skate Shoe,60,FALSE,Black,Canvas,,,VANS,VANS,FALSE,
AVpe9YZj1cnluZ0-awEg,"Sneed- Non Customizable Women's Dance Shoes Latin Satin Chunky Heel Black/blue/brown/gold, Black and Gold-us5 / Eu35 / Uk3 / Cn34 , Black and Gold-us5 / Eu35 / Uk3 / Cn34",53,FALSE,,,,,,SNEED,FALSE,
AVpe9Z56LJeJML43zPJt,'jayde' Mary Jane Block Heel Pump (women) (nordstrom Exclusive),79.9,FALSE,,,,,Louise et Cie,,FALSE,
AVpe9ZelilAPnD_xRzU-,Kamik Women's Jenny Fuchsia Mid-calf Rain Boot,59.99,FALSE,"Fuchsia,Purple",,,Casual,Kamik,,TRUE,
AVpe9ZflLJeJML43zO_H,Easy Spirit E360 Get City  W Round Toe Canvas  Ballet Flats,79,FALSE,,Canvas,,,Easy Spirit e360,Easy Spirit e360,TRUE,
AVpe9ZV5LJeJML43zO7a,Nine West Wixsono Women  Open Toe Synthetic  Wedge Sandal,89,FALSE,White,Synthetic,,,Nine West,Nine West,TRUE,
AVpe9ZZwilAPnD_xRzTF,Easy Spirit Women's Traveltime Slip-on,36.59,FALSE,,,,,Easy Spirit,Easy Spirit,FALSE,
AVpe-a1uilAPnD_xSK5_,Hunter Boy's Original Kids Knee-high Rubber Rain Boot,81,FALSE,Sunlight,,,,Hunter,Hunter,FALSE,
AVpe-abQ1cnluZ0-bIAV,Women's Lugz Drifter Fleece Lx,70.95,FALSE,Golden WheatCreamBarkGum Thermabuck,,,,Lugz,,TRUE,
AVpe-a-l1cnluZ0-bIKS,"Adore-1008sq, 7'' Heel 2 3/4'' Platform Ankle Boot",97.95,FALSE,Gold SequinsGold Chrome,,,,PleaserUSA,PleaserUSA,FALSE,
AVpe-As0ilAPnD_xSBcX,Vans Solana Women  Round Toe Canvas  Sneakers,47,FALSE,,Canvas,,,VANS,VANS,FALSE,
AVpe-AxrilAPnD_xSBdt,Enzo Angiolini Booka   Open Toe Canvas  Sandals,99,FALSE,Beige,Canvas,,,Enzo Angiolini,Enzo Angiolini,TRUE,
