id,name,price,onSale,color,material,condition,occasion,brand,manufacturer,hasHeels,countryOfOrigin
AVpfD2ttLJeJML431f8j,Acorn Women Forest Mule Slippers,58.23,FALSE,Chocolate Owl,,,,Acorn,Totes,FALSE,
AVpfd38YilAPnD_xcP30,Cotton 'Romantic White' Beaded Blouse (India) by Novica,53.99,FALSE,White,,,,Novica,,FALSE,India
AVpfD3baLJeJML431gNZ,Luxury Divas Strappy High Heel Wedge Pumps,44,FALSE,"White,Brown",Man Made Materials,,,Soda,,FALSE,
AVpfD3JO1cnluZ0-dBcz,Lauren Ralph Lauren Mora Ii Women  Round Toe Synthetic  Rain Boot,75,FALSE,,Synthetic,,,Lauren Ralph Lauren,Lauren Ralph Lauren,FALSE,
AVpfd3Ms1cnluZ0-lO4Z,Yu&yu Women's Shoes Fabric Flat Heel Round Toe Slippers Outdoor/casual Black/brown/gray,77.46,FALSE,"Yellow,Gray,Brown",,,,,Qianyuyu,FALSE,
AVpfD3OG1cnluZ0-dBeZ,Liliana GF52 Women's Black/Green/Brown Faux Leather Back Lace-up Inside Zipper Stacked Chunky Heel Riding Boots,39.19,FALSE,"Black,Brown,Green",,,,LILIANA,,TRUE,
AVpfD4_dLJeJML431gxr,Annie Shoes Edina Women  Round Toe Patent Leather  Flats,13.99,FALSE,Beige,Leather,,,Annie Shoes,Annie Shoes,FALSE,
AVpfd4-lLJeJML439s52,Vionic Women's Tide Ii Brown Leopard,69.95,FALSE,,Leather/textile,,,Vionic,Vionic,FALSE,
AVpfd4zyilAPnD_xcQEd,Lifestride Women's Puddle Rain Boot,69.99,FALSE,,,,,LifeStride,,FALSE,
AVpfd5cdilAPnD_xcQNM,Yu&yu Women's Low Heel Comfort Oxfords Shoes (more Colors),98.13,FALSE,"Gold,Silver",,,,,Qianyuyu,FALSE,
AVpfd5rJLJeJML439tEc,"Silverts 103500409 Womens Foamtread Slipper Cloth Tie Brand - Black, Size 9",51.97,FALSE,,,,,Silvert's,,FALSE,
AVpfD63VLJeJML431heL,El Naturalista Womens N382 Funghi Tall Boot Shoes,319,FALSE,"Henna,Night",Leather,,,El Naturalista,El Naturalista,FALSE,
AVpfD6eo1cnluZ0-dCrJ,Yu&yu Women's Shoes Round Toe Low Heel Slippers Shoes More Colors Available,86.76,FALSE,"Pink,Almond,Purple,Orange",,,,,Qianyuyu,FALSE,
AVpfD6JxilAPnD_xUFEw,"Double-tread Slippers,red,s Mdtdbltreads",75.83,FALSE,,,,,Medline,,FALSE,
AVpfd-6MilAPnD_xcRlL,Ellie '406-Doll' Women's Velvet Bow Satin Pumps,48.99,FALSE,"Black,Gold,Pink,Red,White",,,,Ellie,,TRUE,China
AVpfD6sbilAPnD_xUFSI,143 Girl Primotoo   Open Toe Synthetic  Flip Flop Sandal,40,FALSE,,Synthetic,,,143 Girl,143 Girl,TRUE,
AVpfD7c31cnluZ0-dDAo,Womens Sperry Top-sider Seaside Perforated Slip On Fashion Sneakers - Yellow,59,FALSE,Yellow,Leather,,,Sperry,Sperry Top-Sider,TRUE,
AVpfD7q4ilAPnD_xUFoQ,Yu&yu Women's Shoes Round Toe Flat Heel Suede Loafers Shoes More Colors Available,140.2,FALSE,"Fuchsia,Yellow",,,,,Qianyuyu,FALSE,
AVpfD7qC1cnluZ0-dDFn,"Dearfoams Size Small Womens Microfiber Velour Clog Slipper, Sleet",24,FALSE,,,,,Dearfoams,Dearfoams,FALSE,
AVpfd7tV1cnluZ0-lP-i,Toptie Women's Dance Paws Pad Foot Thongs Toe Undies Half Lyrical Shoes,9.08,FALSE,"Beige,Black",,,,TopTie,TopTie,FALSE,
AVpfD80SilAPnD_xUGBq,Frye Malorie Black Leather Button Tall Riding Boots Shoes 8.5 M New Nib $418,91,FALSE,Black,Leather,New with box,,Frye,,TRUE,
AVpfd8r_LJeJML439tzT,Volcom One Way   Round Toe Leather  Loafer,60,FALSE,Gray,Leather,,,Volcom,Volcom,TRUE,
AVpfD8SEilAPnD_xUF2l,Marc Fisher New Brown Women's Shoes Size 10 Fashion Knee-high Leather Boots $179,57.49,FALSE,Browns,Leather,New with box,,Marc Fisher,,TRUE,
AVpfD9021cnluZ0-dD4r,Isotoner Womens Microterry Open Toe Slide Slippers,17.99,FALSE,,No Material Tag,,,Isotoner,Isotoner,TRUE,
AVpfd9KxLJeJML439t7S,"Durango Western Boot Womens 10 Rebel Saddle Rocker Heel Powder Rd3471""",130.62,FALSE,"Blush N Lace,Tan  Pink",,,,Durango,Durango,FALSE,
AVpfd9UA1cnluZ0-lQY7,Sunrolan Bonnie Canvas Casual Women Shoes Flats Slip On Girls Loafers Flats,129.99,FALSE,"-White,-Blue,-Red,-Purple,-Lion",,,,SUNROLAN,,FALSE,
AVpfda0M1cnluZ0-lHab,VIA PINKY EE31 Women's Quilted Lace-up Duck Ankle Bootie Run Half Size Big,23.99,FALSE,"Black,Blue,Brown,Green,Red,Dark Green Tan,Brown Tan,Wine Tan",,,Casual,VIA PINKY,,TRUE,
AVpfDa5K1cnluZ0-c3nR,Jack Rogers Georgica Jelly   Open Toe Synthetic  Thong Sandal,68,FALSE,,Synthetic,,,Jack Rogers,Jack Rogers,TRUE,
AVpfDaac1cnluZ0-c3bm,Yu&yu Women's Shoes Flat Heel Pointed Toe Flats Casual More Colors Available,63.97,FALSE,"Red,Black,Purple",,,,,Qianyuyu,FALSE,
AVpfDacf1cnluZ0-c3cd,Easy Spirit Women's Arilynn Heeled Ankle Boots,60.59,FALSE,"Black,Black Leather",,,Casual,Easy Spirit,Easy Spirit,TRUE,
AVpfdAeOLJeJML439eh4,Carlos Santana Keller Women Us 8.5 Nude Ankle Boot,149,FALSE,,Leather,,,Carlos Santana,,TRUE,
AVpfdAj01cnluZ0-lA9B,"Bejeweled-702, 7'' Heel, 2 1/2''  2 Band Slide Sandal",94.99,FALSE,Clear and Silver,,,,PleaserUSA,PleaserUSA,FALSE,
AVpfdAQKilAPnD_xcBvR,Softwalk Neverland Women N/s Moc Toe Leather  Loafer,130,FALSE,Brown,Leather,,,SoftWalk,SoftWalk,TRUE,
AVpfDB3e1cnluZ0-cvG4,Studswar Cleo   Round Toe Canvas  Sneakers,335,FALSE,"Gold,Silver",Canvas,,,Studswar,Studswar,TRUE,
AVpfDb74ilAPnD_xT6ld,Girl Soft Canvas Elastic Cross Bands Flat Ballet Dancing Shoes Pink Size 34 Pair,21.99,FALSE,Pink,Canvas||Faux Leather||Elastic Band||Flannel,,,Unique Bargains,,FALSE,
AVpfDB-B1cnluZ0-cvJG,"Star-16g, Flat Glitter Women Shoes",31.95,FALSE,"Blue Glitter,Green,Green Glitter,Hot Pink,Lime Green Glitter,Purple Glitter,Red Glitter,Silver Glitter",Manmade.,New,Halloween,PleaserUSA,Pleaser Shoes,TRUE,
AVpfDbMwilAPnD_xT6TZ,Rebecca Minkoff Sloane Sneaker   Round Toe Canvas  Sneakers,295,FALSE,Black,Canvas,,athletic,Rebecca Minkoff,Rebecca Minkoff,FALSE,
AVpfDbRZilAPnD_xT6U9,Skechers Womens Keepsakes Star Bright Knit Comfort Insole Slipper Shoes,27.99,FALSE,Black,Textile/Man Made,,,SKECHERS,Skechers,TRUE,
AVpfdbUCLJeJML439lFp,Valanty Women's Shoes Round Toe Stiletto Heel Pumps With Flower Wedding Shoes More Colors Available,202,FALSE,"Ivory,Blue,White,Red,Black,Pink,Yellow,Purple",,,,,Valanty,FALSE,
AVpfdbwLilAPnD_xcIdE,Caterpillar Women Chromatic Comp Toe Sneakers,126.83,FALSE,Cameo Green,,,,Caterpillar,Wolverine World Wide,FALSE,
AVpfdCc9LJeJML439fBK,Levi's Jeans Stan Buck Women's Canvas Fashion Sneakers Shoes,40,FALSE,"BlackWhite,Charcoal",,,,LEVIS,,TRUE,
AVpfDcCVilAPnD_xT6oL,"Gameday Womens 13 Brass Leather Iowa State Cowboy Boots (size 5) Ios-l051-1""",119,FALSE,Brown,Leather,,,Gameday Boots,GameDay Boots,FALSE,
AVpfdCh41cnluZ0-lBbG,Bloch Dance Jazzsoft Jazz Shoe (Toddler,25.52,FALSE,,,,,Bloch,,FALSE,
AVpfDcIRilAPnD_xT6qg,Easy Spirit Women's Getfestive Flat,36.59,FALSE,Light Copper Leather,,,,Easy Spirit,Easy Spirit,FALSE,
AVpfDcUQilAPnD_xT6vB,Women's David Tate Prom Silver Mesh/Satin by David Tate,104.95,TRUE,Silver,,,,David Tate,,TRUE,United States
AVpfDCzwLJeJML431N_X,Annie Shoes Lillian   Peep-toe Canvas  Heels,60,FALSE,Green,Canvas,,,Annie Shoes,Annie Shoes,TRUE,
AVpfDD9zLJeJML431OXx,American Eagle Womens Shoes White Canvas Size 8 Hepburn Flats Red Black Line,9.99,FALSE,,,,Casual,American Eagle,,FALSE,
AVpfDDgQLJeJML431ON1,Me Too Womens Freja Tall Riding Boot Shoe,150,FALSE,"Black,Storm",Leather,,,Me Too,Me Too,TRUE,
AVpfdDobLJeJML439fTd,Riverberry Womens Grayson Metal Loop T-strap Flat Sandal,21.99,FALSE,"Black,Blue,Chestnut,Fuchsia,Nude",Synthetic,,,Riverberry,,FALSE,
AVpfDdUk1cnluZ0-c4f7,Rialto Felicity Women Us 6 Brown Clogs,54,FALSE,,Synthetic,,,Rialto,,TRUE,
AVpfDdwSilAPnD_xT7PQ,"Sneed- Customizable Women's Dance Shoes Latin/salsa Satin Customized Heel Black/blue/yellow/pink/purple/red/white/fuchsia, Yellow-us6.5-7 / Eu37 / Uk4.5-5 / Cn37 , Yellow-us6.5-7 / Eu37 / Uk4.5-5 / Cn37",88,FALSE,,,,,,SNEED,FALSE,
AVpfDE_aLJeJML431OtK,"Simplicity Winter Boot Covers In Multicolor Stripes Knit Pattern, Grey Black",7.99,FALSE,"green grey,Green Orange,Grey Black,Yellow Blue,Red Grey",,,,Simplicity,Simplicity,FALSE,
AVpfDe1FLJeJML431Xmy,Alfani Hannia Women Us 8.5 Gold Thong Sandal Pre Owned 1904,0.99,FALSE,Gold,Synthetic,,,Alfani,,TRUE,
AVpfDEB5LJeJML431OY-,'hazel' Ankle Strap Pump (women),94.95,FALSE,,,,,Seychelles,,FALSE,
AVpfDEbY1cnluZ0-cv8n,Pleaser Illusion-658rs Women's Rhinestone High Stiletto Heel Ankle Strap Sandals,112.95,FALSE,"CLEATHERARBLACK,CLEATHERARSILVER CHROME,Clear and Black",,,,PLEASER,,TRUE,
AVpfDEcPLJeJML431Oh7,Dije California Women's Brittany Moccasin,35.08,FALSE,,,,,Dije California,,FALSE,
AVpfdeFN1cnluZ0-lINl,Faded Glory Women's Jewel Sandal,16.82,FALSE,GOLD,,,,Faded Glory,,FALSE,
AVpfDeNkilAPnD_xT7YN,New Balance Mx626  W Round Toe Leather  Cross Training,66.99,TRUE,White,Leather,,athletic,New Balance,New Balance,FALSE,
AVpfdeNL1cnluZ0-lIPo,Vans Classic Slip-on Women  Round Toe Leather Silver Skate Shoe,50,FALSE,,Leather,,,VANS,VANS,FALSE,
AVpfdet81cnluZ0-lIY_,Womens Easy Spirit Mariel Comfort Mary Jane Walking Shoes - Black Multi/black,75,FALSE,"Black,Blue",Fabric,,,Easy Spirit,Easy Spirit,TRUE,
AVpfDf8J1cnluZ0-c5aH,Acacia Base Hit-low Baseball/softball Shoes,13.41,FALSE,BlackPink,,,,Acacia,,FALSE,
AVpfDFG7ilAPnD_xTyyH,Naughty Monkey Fresh Fry Women Us 8.5 Brown Slingback Sandal Pre Owned 1690,25.99,FALSE,Brown,Leather,,,Naughty Monkey,,TRUE,
AVpfdfgl1cnluZ0-lImZ,"Sneed- Customizable Women's Dance Shoes Latin/salsa Satin Customized Heel Black/blue/yellow/pink/purple/red/white/fuchsia, Bronze-us9.5-10 / Eu41 / Uk7.5-8 / Cn42 , Bronze-us9.5-10 / Eu41 / Uk7.5-8 / Cn42",86,FALSE,,,,,,SNEED,FALSE,
AVpfdFmR1cnluZ0-lCMq,Donald J Pliner Danti-06 Women  Round Toe Leather Black Mid Calf Boot,465,FALSE,,Leather,,,Donald J Pliner,Donald J Pliner,TRUE,
AVpfDFp5ilAPnD_xTy9h,Rachel Rachel Roy Kadirah Womens Size 8.5 M Multi-colored Booties Shoes G497,44.62,FALSE,Multi-Color,Synthetic,New with box,,Rachel Rachel Roy,,TRUE,
AVpfDfr91cnluZ0-c5Tr,Michael Michael Kors Flex Mid Pump   Pointed Toe Leather  Heels,99,FALSE,Silver,Leather,,dress,MICHAEL Michael Kors,MICHAEL Michael Kors,FALSE,
AVpfDfv4LJeJML431X9a,Minnetonka Kathleen Kilty Moc Suede Loafer,59.99,FALSE,Black,,,,Minnetonka,,FALSE,
AVpfDFWgilAPnD_xTy3W,Azura Women Paula Sandals,75,FALSE,"Black,Orange",,,,Azura,Spring Footwear,FALSE,
AVpfDfWhLJeJML431XzH,New Directions Precious Women  Round Toe Synthetic  Ballet Flats,50,FALSE,"Gold,Gray",Synthetic,,,New Directions,New Directions,TRUE,
AVpfdG4-1cnluZ0-lCir,"Women's Shoes 7 1/2 Platform Clear Upper & Black Glitter Bottom - Clear Vinyl""",66.34,FALSE,,,New,Halloween,The Highest Heel,The Highest Heel,FALSE,
AVpfDg92ilAPnD_xT8W6,Rockport Women's Total Motion 75mm Pointy Toe Layer Bootie,189.95,FALSE,,,,,Rockport,,FALSE,
AVpfDGAwilAPnD_xTzE2,Easy Spirit Joyz   Open Toe Patent Leather  Platform Sandal,79,FALSE,,Leather,,fashion,Easy Spirit,Easy Spirit,FALSE,
AVpfdgeMLJeJML439mdW,'addie' Sandal (women),395,FALSE,,,,,Vince,,FALSE,
AVpfDgfIilAPnD_xT8LF,Bongo Women's Bora Black Embellished Sandal,24.99,FALSE,"Tan,Black",,,Casual,Bongo,,TRUE,
AVpfdgpailAPnD_xcJvS,Wear Ever Women's Gari Black Wedge Sandal,49.99,FALSE,"Natural,Black",,,Casual,Wear Ever,,TRUE,
AVpfdGwWilAPnD_xcDWK,Nike Women's Free Trainer 3.0 V4 Black/vivid Purple/lunar Grey Low Top Synthetic Cross Trainer Shoe - 7.5m,115.08,FALSE,,Synthetic,,,Nike,Nike,FALSE,
AVpfDHGy1cnluZ0-cwzF,Unlisted Kenneth Cole Jazz Stand Women Open Toe Synthetic Gladiator Sandal,28.59,FALSE,Mint,Synthetic,,,Kenneth Cole Unlisted,Kenneth Cole Unlisted,TRUE,
AVpfDhH_ilAPnD_xT8aZ,Easy Spirit E360 Grotto Women Us 7 W Brown Loafer,80,FALSE,,Leather,,,EASY SPIRIT E360,,TRUE,
AVpfDhkNLJeJML431Ym7,Women's David Tate Sexy Black Kid/Suede/Patent by David Tate,104.95,TRUE,,,,,David Tate,,TRUE,United States
AVpfdHQSLJeJML439gPC,New Balance W980   Round Toe Canvas  Running Shoe,110,FALSE,Black,Canvas,,,New Balance,New Balance,FALSE,
AVpfDIBV1cnluZ0-cxFA,Alfani Jaymee   Round Toe Leather  Knee High Boot,179,FALSE,,Leather,,,Alfani,Alfani,TRUE,
AVpfDidi1cnluZ0-c6UG,Unlisted Women's Whole Truth Slip On Ballet Flats,24.57,FALSE,"BlackNavy,Luggage Riding PU",,,,Unlisted,Unlisted,FALSE,
AVpfdifqLJeJML439m_I,Womens Tory Burch White / Gold Patent Leather Flip Flops Shoes Sz. 7 M New!,100,TRUE,White,Patent Leather,,,Tory Burch,,TRUE,
AVpfdIJUilAPnD_xcDtn,Gleader Top Modern Canvas Jazz Ballet Dance Shoes Split Heels Soft Sole White For Men Women Ds002-9,8.68,FALSE,,,,,Gleader,Gleader,FALSE,
AVpfDiPkLJeJML431Y18,Mia Horseback    Pointed Toe Synthetic  Western Boot,80,FALSE,,Synthetic,,,Mia,MIA,FALSE,
AVpfdJ4RilAPnD_xcEIm,"Vince Camuto 3520 Womens Lorim Black Platform Heels Shoes 8 Medium (b,m) Bhfo",15.5,FALSE,Black,Leather/Man Made,,,Vince Camuto,,TRUE,
AVpfdJfn1cnluZ0-lDO8,Skechers Women's Og 95 - Color Crew Casual Shoe,35.99,FALSE,Black,Mesh,,Lifestyle,SKECHERS,Skechers,FALSE,
AVpfDjUtLJeJML431ZPJ,Walking Cradles Kicker   Round Toe Leather  Ankle Boot,140,FALSE,Brown,Leather,,,The Walking Cradle Company,Walking Cradles,TRUE,
AVpfDjvDilAPnD_xT9VR,Mary Jane Sneaker (women),610,FALSE,,,,,Marni,,FALSE,
AVpfDKGp1cnluZ0-cxxz,Women's Hydropower 4 Deck Shoe,33,FALSE,"White,NavyMagentaSilverWhite",,,,Helly Hansen,,FALSE,
AVpfdkJhilAPnD_xcKor,Marc Fisher Noreene Women  Round Toe Suede  Knee High Boot,189,FALSE,Green,Suede,,,Marc Fisher,Marc Fisher,FALSE,
AVpfDkmfLJeJML431ZsP,Mia New Women's Black Glitterati Gladiator Sandals Sz. 8.5m,24.94,FALSE,Black,Synthetic,,Casual,Mia,,FALSE,
AVpfDktS1cnluZ0-c7HP,'kacy' Caged Ghillie Sandal (women),89.96,FALSE,,,,,Louise et Cie,,FALSE,
AVpfDL14ilAPnD_xT0_V,Dyeables Becky Women Us 6.5 D White Open Toe Heels,75,FALSE,,Canvas,,,Dyeables,,TRUE,
AVpfDL5E1cnluZ0-cyXb,Yu&yu Women's Shoes Patent Leather Chunky Heel Round Toe Oxfords Outdoor/casual Black/pink/white,86.76,FALSE,"White,Black,Pink",,,,,Qianyuyu,FALSE,
AVpfDlkB1cnluZ0-c7Zy,Cape Robbin Belle-tz-1 Women  Open-toe Synthetic  Slingback Sandal,50,FALSE,Brown,Synthetic,,,Cape Robbin,Cape Robbin,TRUE,
AVpfdLOB1cnluZ0-lDqG,Women's SoftWalk Napa Flat Black/White/Grey Seersucker Leather/Soft Dull,109.95,FALSE,Bronze LeatherBlack Patent,,,,SoftWalk,,TRUE,
AVpfdlYR1cnluZ0-lKIe,Puma Womens Faas 300 Mesh Lightweight Running Shoes,53.99,FALSE,WhiteVirtual Pink,Unknown,,,PUMA,Puma,TRUE,
AVpfDm4ZLJeJML431ae6,Skechers Women's Ez Flex 2 Bed of Roses Shoe,64.99,FALSE,,,,,Skechers,,FALSE,
AVpfDmcPLJeJML431aU9,Nine West Shape Up Women  Open Toe Suede Black Sandals,90,FALSE,Black,Suede,,,Nine West,Nine West,FALSE,
AVpfDMRX1cnluZ0-cyfX,Vans Unisex Classic Slip-on (premium Leather) Skate Shoe,65,FALSE,TrwhtMo,Leather,,"Casual Shoes,Skate Shoes",VANS,VANS,FALSE,
AVpfDMtR1cnluZ0-cyo7,Funtasma Hunter Heel Fur Trim Knee Boot by FUNTASMA,92.54,FALSE,"Black,Brown,Tan,Black Brown Tan,Blk Microfiber,Tan Microfiber,Brown Microfiber,Multicolor",,,,FUNTASMA,,TRUE,China
AVpfDnih1cnluZ0-c8Ey,Coach Zan Women Us 5.5 Tan Heels Defect Blemish 1690,23.99,FALSE,Beige,Patent Leather,,,Coach,,TRUE,
AVpfdNnBLJeJML439hyP,Corkys Womens Rachel Wedge Sandals,49.95,FALSE,,rubber/ elastic,,,CORKYS,,FALSE,
AVpfdnvk1cnluZ0-lKxN,Easy Spirit E360 Stellar   Round Toe Canvas  Sneakers,79,FALSE,,Canvas,,,Easy Spirit e360,Easy Spirit e360,FALSE,
AVpfDnVlilAPnD_xT-kJ,Guess Jacqui Women  Round Toe Leather Black Boot,169,FALSE,,Leather,,,GUESS,Guess,FALSE,
AVpfDNxdilAPnD_xT1oB,Dan Post Western Boots Womens 12 Mad Cat Triad Studded Tan Dp3446,240,FALSE,Tan,,,,Dan Post,,FALSE,
AVpfDNyg1cnluZ0-czAO,Women's Spenco Yumi Sandal True Red,42.49,FALSE,True Red,Synthetic,,,Spenco,Spenco,TRUE,
AVpfDocELJeJML431bB3,"Calvin Klein Jeans 6110 Womens Opel Tan Thong Sandals 6.5 Medium (b,m) Bhfo",22.58,FALSE,Tan,,New with box,,Calvin Klein Jeans,,TRUE,
AVpfDODeilAPnD_xT1uQ,Capezio Women's H07 Footundeez Lyrical/modern Shoe,19.38,FALSE,"Black,Light Suntan,Espresso,Nude",,,,,Capezio,FALSE,
AVpfdOFUilAPnD_xcFJK,Yu&yu Women's Shoes Round Toe Comfort Creepers Platform Canvas Fashion Sneakers More Colors Available,92.96,FALSE,"Red,Navy",,,,,Qianyuyu,FALSE,
AVpfdoIm1cnluZ0-lK4M,Women's ara Bel 43708 Titan Metallic Calf/Black Patent Tip,148.95,FALSE,,,,,Ara,,FALSE,United States
AVpfdOLwilAPnD_xcFK0,Slm Women's Slip On Garden Clogs,9.95,FALSE,"Aqua Blue,Black,Lime Green,Pink",Synthetic,,,SLM,,FALSE,
AVpfDOPhLJeJML431RwA,"Hot-selling Brand New Latin Dance Shoes High Heel For Ladies/girls/women/ballroom Tango Shoes 7cm-black With Gold,9",19.52,FALSE,,,,,,Generic,FALSE,
AVpfDos71cnluZ0-c8cY,"Sneed- Customizable Women's Dance Shoes Latin/salsa Satin Customized Heel Black/blue/yellow/pink/purple/red/white/fuchsia, Blue-us8.5 / Eu39 / Uk6.5 / Cn40 , Blue-us8.5 / Eu39 / Uk6.5 / Cn40",148,FALSE,,,,,,SNEED,FALSE,
AVpfDOuN1cnluZ0-czUI,Dr. Scholl's Women's Roar Almond Toe Flat,16.97,FALSE,,,,,Dr. Scholl's,,FALSE,
AVpfDp0lLJeJML431ben,Cotton Alpaca 'Misty Warmth' Sweater (Peru),79.99,TRUE,Grey,,,,Novica,,FALSE,
AVpfdpEFLJeJML439osj,Nike Women's Comfort Slides,32,FALSE,,,,,Nike,,FALSE,
AVpfDpHtilAPnD_xT_Jt,Skechers Women's Relaxed Living-tweedy Casual Shoe,36.68,FALSE,,Textile,,,SKECHERS,Skechers,FALSE,
AVpfdpn9LJeJML439o2F,City Classified Women's Bradley Faux Suede Round Toe Hidden Wedge W/ Extra Padding Insole,24.99,FALSE,,,,,City Classified,,FALSE,
AVpfDPrBLJeJML431SOO,"Burberry New Womens Shoes Size 40, Us 10 Patent Leather Tall Boots Black",249.99,FALSE,Black,Patent Leather,,Casual,Burberry,,TRUE,
AVpfDPssLJeJML431SO5,Women's Nine West Rollover Slingback,47.95,FALSE,"Natural Synthetic,Pink Synthetic",,,,Nine West,,TRUE,
AVpfDPVi1cnluZ0-czhI,'kickstart' Mesh Sneaker (women),54.95,FALSE,,,,,Keds,,FALSE,
AVpfDpxuLJeJML431bdo,Ann Marino Strap Women  Open-toe Leather  Heels,55,FALSE,,Leather,,,Ann Marino,Ann Marino,TRUE,
AVpfdpyvLJeJML439o5F,Propet Stability Walker - Womens - White,66.95,FALSE,,,New,,Propet,Propet,FALSE,
AVpfDQHCLJeJML431SYr,Women's Impact Pulse Dance Shoe,75,FALSE,"BlackNeopulse,PinkBlack,YellowCerise Pink,TurquoiseNeon Yellow,Neopulse Pink,CoralGunmetal,Graphite Camo,BlueYellow",,,,Zumba,,FALSE,
AVpfDQMgilAPnD_xT2c0,Nike Flyknit Lunar 3 Women  Round Toe Synthetic Black Running Shoe,150,FALSE,Black,Synthetic,,,Nike,Nike,FALSE,
AVpfDqZILJeJML431brV,Wanted Kingdom Women's Sandals & Flip Flops,59.95,FALSE,Natural,Synthetic,,,Wanted,,FALSE,
AVpfDr__ilAPnD_xUAJK,Nike Women's Fs Lite 2 Run Running Shoes,75,FALSE,,,,,Nike,,FALSE,
AVpfDrCNilAPnD_xT_0S,Franco Sarto Ballet Flat Wedges Model Sz 7.5 Red Open Toe Suede Women's Shoes,9.99,FALSE,Red,Suede,New with box,,Franco Sarto,,FALSE,
AVpfdrkP1cnluZ0-lLz5,Inc International Co Galai Women Us 8 Black Flats Pre Owned 1905,69.99,TRUE,Black,Canvas,,,INC International Concepts,,TRUE,
AVpfDRRR1cnluZ0-c0M_,Carlos Santana Kendra Women Us 7.5 Gold Sandals Blemish 1906,9.99,FALSE,Gold,Synthetic,,,Carlos Santana,,TRUE,
AVpfDSimLJeJML431TPJ,Blue Women's 'Sutton' Ankle Lace Pointy Flats,26.99,FALSE,"Black,Gold,Silver",,,,Blue,,TRUE,China
AVpfdsJr1cnluZ0-lL_k,Nib Poetic Licence Womens Wonder About Black Slip On Wedge Heels Shoes Sz 8.5 M,39.99,FALSE,"Black,Red,White",Synthetic Leather,New with box,,Poetic Licence,,TRUE,
AVpfdsQHilAPnD_xcM13,Anne Klein Ak 7 Vama Women Us 8.5 Black Moc Loafer Pre Owned 1661,6.99,FALSE,Black,Synthetic,,,Anne Klein AK,,TRUE,
AVpfDSr01cnluZ0-c0rR,What's What Aerosoles Black Leather Slide~sandal~shoe~women's Size 8b,12.99,FALSE,Black,,,Casual,What's What by Aerosoles,,TRUE,
AVpfDSRlilAPnD_xT3Kz,Forever Ge99 Women's Multiple Buckle Straps Mid Calf Flat Heel Winter Boots,31.99,FALSE,"Tan,Black,Brown",,,casual,Forever,,TRUE,
AVpfdsVcilAPnD_xcM3s,Allegra K Women's Rounded Toe Mid Heel Length Ankle Strap Pumps Red (size 7),58.99,FALSE,"Red,Black,Beige",Heel PU Outsole Rubber Vamp PU,,,Allegra K,,FALSE,
AVpfdSzVilAPnD_xcGT1,Steve Madden Women's Retrro Suede Ankle-high Leather Boot,36.1,FALSE,Olive,,,,Steve Madden,Steve Madden,FALSE,
AVpfDt_mLJeJML431c7W,Dan Post Western Boots Womens 11 Aztec Carlita Tan Green Dp3292,270,FALSE,Tan Green,,,,Dan Post,,FALSE,
AVpfDt5jLJeJML431c5e,Lucky Brand Casmett Women's Sandals & Flip Flops,89,FALSE,,nubuck,,,Lucky Brand,,FALSE,
AVpfDT8_LJeJML431Tvm,Toms Women's Classic Canvas Ash Canvas Ankle-high Canvas Flat Shoe - 6.5m,40.09,FALSE,Off-White,,,Fashion,TOMS,Toms,FALSE,
AVpfDTaWilAPnD_xT3j4,361 Women 361 Wildstar Running Sneakers,80,FALSE,,,New,,361,361,FALSE,
AVpfdtwWLJeJML439qBJ,New Balance Women's 711 Training Shoe,79.99,FALSE,,,,,New Balance,,FALSE,
AVpfDug0ilAPnD_xUBA4,Xoxo Women's Alina Thong Sandals,24.59,FALSE,"Black,Coral,Pink",,,Casual,XOXO,XOXO,FALSE,
AVpfD-ujilAPnD_xUGuc,Naturalizer Women's Jamison Wide-shaft Riding Boot,92.59,FALSE,Banana Bread,,,,Naturalizer,Naturalizer,FALSE,
AVpfdUkTilAPnD_xcGu5,Jbu By Jambu Madison   Round Toe Canvas  Sneakers,80,FALSE,White,Canvas,,athletic,JBU by Jambu,JBU by Jambu,FALSE,
AVpfduUnLJeJML439qMT,Trina Turk Berkeley Women  Open Toe Leather  Thong Sandal,248,FALSE,,Leather,,,Trina Turk,Trina Turk,FALSE,
AVpfDuWgilAPnD_xUA9D,Toms Women's Jutti Flat Casual Shoe,81.38,FALSE,Cheetah Suede,Suede,,Casual Shoes,TOMS,TOMS,FALSE,
AVpfdUxELJeJML439jih,Rocket Dog Womens Gosford Wedge Sandal,35.72,FALSE,"Black,Natural",,,,Rocket Dog,Rocket Dog,FALSE,
AVpfdvEN1cnluZ0-lMz_,Yu&yuwomen's Shoes Leather Chunky Heel Pointed Toe Pumps Career Shoes,189.87,FALSE,"Tan,Black",,,,,Qianyuyu,FALSE,
AVpfDvVhLJeJML431dZW,"Nike Women's Air Embellish Golf Shoes (white/vapor Mauve/silver, 7 Med) New",69.99,FALSE,White,,,,Nike,Nike,FALSE,
AVpfdw5hilAPnD_xcOGv,Toms Leila Women  Round Toe Suede  Ankle Boot,119,FALSE,Gray,Suede,,,TOMS,Toms,FALSE,
AVpfDw5silAPnD_xUB06,Coloriffics Kayla Women Us 7.5 Red Open Toe Heels,109,FALSE,,Synthetic,,,Coloriffics,,TRUE,
AVpfDW8qilAPnD_xT4xW,NATURE BREEZE FE61 Women Snap Cuff Over The Knee Flat Heel Boots,35.99,FALSE,"Black,Brown,Grey,Red,Tan,Taupe,Wine",,,Casual,Nature Breeze,,TRUE,
AVpfDwBL1cnluZ0-c--V,"Belle-301rs, 3'' Heel Clear Mule Slide Sandal",42.93,FALSE,,,,,PleaserUSA,PleaserUSA,FALSE,
AVpfdwDp1cnluZ0-lNGw,Juicy Couture Womens Dakota Patent T-strap Wedges,98.99,FALSE,Bright Yellow Patent,Unknown,,,Juicy Couture,Juicy Couture,TRUE,
AVpfDwuzilAPnD_xUBxb,Parisa Suede Sandal,595,FALSE,Caramel,,,,Ralph Lauren,,FALSE,
AVpfDX8p1cnluZ0-c2hY,Coconuts By Matisse Women's Cowgirl Cognac Western Boot,101.99,FALSE,Cognac,,,Casual,Coconuts by Matisse,,TRUE,
AVpfDX8RilAPnD_xT5Hu,Yu&yu Women's Shoes Chunky Heel Round Toe Oxfords Shoes More Colors Available,106.54,FALSE,"Red,Black,Brown",,,,,Qianyuyu,FALSE,
AVpfDXbG1cnluZ0-c2U2,Naturalizer Womens Darlene Leather Almond Toe Pumps,35.99,FALSE,,Leather & Man Made Upper/Man Made Outsole,,,Naturalizer,Naturalizer,TRUE,
AVpfdXEXLJeJML439kI5,Easy Spirit Womens Pine Leather Contrast Wedge Boots,54.99,FALSE,,Unknown,,,Easy Spirit,Easy Spirit,TRUE,
AVpfdXyYilAPnD_xcHlz,New Talbots Dasy Black 47258 Chunky Heel Leather Pumps Size 9m - Nib,48,FALSE,Black,Leather,New with box,,Talbots,,TRUE,
AVpfDyA11cnluZ0-c_oC,Womens Michael Michael Kors Allie Wrap Trainer Fashion Sneakers - Vanilla,135,FALSE,,Leather,,,Michael Kors,Michael Kors,TRUE,
AVpfDyAeilAPnD_xUCLR,Toe Warmers Glacier Women Us 10 N/s Black Winter Boot,142,FALSE,,Synthetic,,,Toe Warmers,,TRUE,
AVpfdyq-1cnluZ0-lNwe,Women's Dawgs Premium Slides,19.99,FALSE,"Tan with Black,Black With Tan,Peacock with White,Black with Black,White with Black",,,,DAWGS,"USA Dawgs, Inc.",FALSE,
AVpfDYym1cnluZ0-c20a,"Vision Street Wear Womens Canvas Hi Skate Shoe, White/yellow, Us 10.5",55,FALSE,"Grey  Pink,White  Yellow,Cheetah,Turqoise,Print",Canvas,New,,Vision Street Wear,Vision Street Wear,FALSE,
AVpfDZ3cilAPnD_xT50p,"121-marc, 1'' Heel Knee High Boots",48.48,FALSE,"Blue,White,Red,Black,Green",Polyurethane,,,ELLIE SHOES,ELLIE SHOES,FALSE,
AVpfDzdQ1cnluZ0-dAJ-,Kelsi Dagger Breda Women  Round Toe Suede Gray Ankle Boot,24.99,FALSE,,Suede,,,Kelsi Dagger,Kelsi Dagger,TRUE,
AVpfDZnk1cnluZ0-c3IM,Open Toe,69.95,FALSE,"Black Satin,Tan Satin",,,,DanceNwear,,FALSE,
AVpfdZnt1cnluZ0-lHNW,Yu&yu Women's Shoes Round Toe Flat Heel Loafers More Colors Available,196.29,FALSE,"White,Black",,,,,Qianyuyu,FALSE,
AVpfdzui1cnluZ0-lOAS,Women Nike Air Zoom Pegasus 31 Running Shoes Size 6 Blue Pink White 654486 416,59.99,FALSE,Blue,Synthetic,New without box,,Nike,,FALSE,
AVpfdzwiilAPnD_xcOz8,Calvin Klein Zihanna Calf Women  Peep-toe Leather Black Bootie,149,FALSE,,Leather,,,Calvin Klein,Calvin Klein,TRUE,
AVpfDZyzLJeJML431VyL,Ivanka Trump Lagrand Black Womens Shoes Size 7 M Flats Msrp $125,42.5,TRUE,Blacks,Leather,,,Ivanka Trump,,FALSE,
AVpfE_eO1cnluZ0-da_u,Alpine Swiss Womens Flip Flops Sandal Soft Terrycloth Thongs Platform Wedge Heel,22.5,FALSE,"Black,Blue",Man-Made Materials,,,Alpine Swiss,,FALSE,
AVpfE_geilAPnD_xUdZ6,Bussola Style Postdam   Open Toe Leather  Sandals,125,FALSE,,Leather,,,Bussola Style,Bussola Style,FALSE,
AVpfE_x_LJeJML4315nh,Eldred Women Size 6.5 Black Leather Work Boot,88,FALSE,Blacks,,,,Skechers,,FALSE,
AVpfE0gQLJeJML4311nI,Muk Luks    Speckled Melana Boot Brown,65,FALSE,Brown,,,,MUK LUKS,Muk Luks,TRUE,
AVpfe15rilAPnD_xcg-6,"Women's Classic Rainboot, Wide Width",12.88,FALSE,Black,,,,Unbranded,,FALSE,
AVpfe19J1cnluZ0-lgRH,'seacoast' Boat Shoe (women),59.95,FALSE,,,,,Sperry,,FALSE,
AVpfe1I81cnluZ0-lgDE,Tommy Hilfiger Women's Darcell Synthetic Ankle-high Leather Boot,80.04,FALSE,,,,,Tommy Hilfiger,Tommy Hilfiger,FALSE,
AVpfE1ldLJeJML4312AE,Fergalicious Sunday Women  Open-toe Synthetic  Slingback Sandal,40,FALSE,,Synthetic,,,Fergalicious,Fergalicious,FALSE,
AVpfE1Nb1cnluZ0-dXWz,"Caress-401, 4'' Stiletto Heel Slide Sandal",31.58,FALSE,Clear and Clear,,,,PleaserUSA,PleaserUSA,FALSE,
AVpfE1OAilAPnD_xUZyY,New Tommy Bahama Womens Antigua Bronze Wood Sandals 10,125,FALSE,,Wood,,,Tommy Bahama,,TRUE,
AVpfE1ZjLJeJML43117m,"Sneed- Women's/kids' Dance Shoes Latin Leatherette/paillette Flat Heel Blue/pink/silver/gold, Silver-us7 / Eu39 / Uk6 Big Kids , Silver-us7 / Eu39 / Uk6 Big Kids",70,FALSE,,,,,,SNEED,FALSE,
AVpfE2Iq1cnluZ0-dXsa,Capelli Women's Sadie Leopard Print Jelly Rain Boot,34.99,FALSE,Leopard Print,,,Casual,Capelli,,TRUE,
AVpfe2Y0LJeJML439-Ax,Nike Flyknit Lunar2 Women  Round Toe Synthetic Purple Running Shoe,150,FALSE,Purple,Synthetic,,,Nike,Nike,FALSE,
AVpfe46v1cnluZ0-lhEK,Kamik Daisies Women  Round Toe Synthetic Blue Rain Boot,80,FALSE,,Synthetic,,,Kamik,Kamik,TRUE,
AVpfE4aS1cnluZ0-dYiW,Michael Michael Kors Arley Riding Boot   Round Toe Leather  Knee High Boot,295,FALSE,,Leather,,,MICHAEL Michael Kors,MICHAEL Michael Kors,TRUE,
AVpfE-4qilAPnD_xUdLN,Natural Soul Resume Women's Boots,99,FALSE,"Black,Grey",synthetic-and-fabric,,,Natural Soul,,FALSE,
